,Unnamed: 0,_id,ltable_ID,rtable_ID,ltable_name,ltable_category,ltable_developer,ltable_rating,rtable_name,rtable_category,rtable_developer,rtable_rating,label
2338,19771,19771,a3583,b1817,Colors Matching Games for Kids,Educational,Eggroll Games,4.3,Pop Dots Jam Family Game for Kids of All Ages,LLC,"Uberapps: The Best Top Free Addictive Casual Tap Games, LLC",874 Ratings,0
2138,18841,18841,a1332,b1704,BIG WIN Racing,Sports,Hothead Games,3.9,Big Win Racing,Sports,Hothead Games Inc.,4.07498,1
798,8252,8252,a653,b727,Call of Duty\u00ae: Heroes,Action,"Activision Publishing, Inc.",4.4,Call of Duty: Black Ops Zombies,Entertainment,"Activision Publishing, Inc.",4.56653,0
1870,16619,16619,a420,b1589,3D Monster Truck Parking Game,Racing,Play With Games,3.9,3D Emergency Parking Simulator Game - Real Police Fire-Truck Ambulance Car Driving School Test Park Sim Racing Games,Play With Games Ltd,Play With Games Ltd,3.69369,0
2007,17922,17922,a1549,b1656,Bike Race 3D - Moto Racing,Racing,MTS Free Games,3.9,Bike Race Pro - Top Motorcycle Racing Game,Games,Top Free Games,4.79661,0
2571,24046,24046,a2745,b1986,GSN Casino: Free Slot Machines,Casino,"GSN Games, Inc.",4.3,Slots Games - Free Casino Slot Machines,Casino,Huuuge Games Sp. z o.o.,2.875,0
626,7499,7499,a2284,b596,Hotel Dash Deluxe,Casual,Glu,3.8,Hotel Dash,Entertainment,Glu Games Inc,3.88807,0
495,6322,6322,a44,b517,War of Nations: PvP Domination,Strategy,Rockyou Inc.,3.8,War of Nations - PVP Strategy MMO,Strategy,"RockYou, Inc.",3.02632,0
3736,36934,36934,a853,b3041,Clash of Lords 2: New Age,Strategy,IGG.COM,4.5,Clash of Lords 2: Heroes War,Action,IGG.COM,3.33333,0
1616,15442,15442,a1439,b1409,Hanging With Friends,Word,Zynga,4.2,Word Streak With Friends - FREE,Entertainment,Zynga Inc.,4.03571,0
1782,16253,16253,a1354,b1541,Bubble Witch Saga,Casual,King,4.1,Bubble Witch 2 Saga,Arcade,King,4.425,0
2206,19169,19169,a450,b1767,MMX Racing,Racing,Hutch Games,4.2,MMX Hill Climb Off-Road Racing,Action,Hutch Games Ltd,4.49934,0
1890,16691,16691,a2455,b1591,Sniper Shooter Free - Fun Game,Action,Fun Games For Free,4.5,Monster Truck by Fun Games For Free,Arcade,Fun Games For Free,4.49278,0
790,8179,8179,a2306,b712,Best Dress Up and Makeup Games,Casual,Best Girls Dress Up Makeup and Nail Manicure Games,3.8,"Go Go Goat! Free Game - by Best, Cool &amp; Fun Games",Best Free Games - Top Apps,Best Free Games - Top Apps,4.5,0
2557,23970,23970,a2613,b1984,Roulette - Casino Style!,Casino,RNF Technologies Pvt Ltd,4,Roulette Royale - FREE Casino ( Mywavia Studios ),Casino,Mywavia Studios Pvt. Ltd.,4.45454,0
3947,40528,40528,a1726,b3298,2048 Number puzzle game,Puzzle,Estoty Entertainment LLC,4.4,Word Jewels 2 Wordsearch Crossword Puzzle Game!,Education,Boy Howdy Technology LLC,4.69998,0
2414,21848,21848,a2144,b1884,Make It Rain: Love of Money,Casual,"Space Inch, LLC",4.1,Candy Soda Slots Turbo Journey of Sinners - (Crush it with Master Vegas Jackpot Casino) Free,Entertainment,Hotel Romeo Media LLC,4.19048,0
3390,34975,34975,a88,b2702,Bike Racing : Off road,Racing,Racing Games Android,3.8,Gas Station Car Parking Simulator a Real Road Racing Park Game,Racing,Play With Games Ltd,4.1645,0
4178,43134,43134,a766,b3584,Rivals at War: Firefight,Action,Hothead Games,4.4,Rivals at War: 2084,Simulation,Hothead Games Inc.,3.95652,0
2276,19375,19375,a339,b1808,Bike Mayhem Mountain Racing,Racing,Best Free Games Inc.,4.3,Bike Race Free - Top Motorcycle Racing Game,Games,Top Free Games,4.78322,0
2960,30056,30056,a1538,b2251,Trivia Crack,Trivia,Etermax,4.5,Trivia Crack (Ad Free),Entertainment,Etermax,none,0
3662,36514,36514,a48,b2967,Total Domination - Reborn,Strategy,Plarium Global Ltd,3.9,Total Domination - Reborn,Entertainment,Plarium Global Ltd,4.05881,1
417,5420,5420,a1442,b452,Words With Friends Classic,Word,Zynga,4.3,Words With Friends Classic,Word,Zynga Inc.,3.13605,1
3278,33969,33969,a1985,b2598,Flight Simulator: Airplane 3D,Simulation,i6 Games,3.8,Flight Pilot Simulator 3D: Flying Game For Free,Simulation,Fun Games For Free,4.5732,0
742,7808,7808,a1548,b658,City Bike Racing 3D,Racing,i6 Games,3.7,Bike Race Free - Top Motorcycle Racing Game,Games,Top Free Games,4.7812,0
2127,18656,18656,a1956,b1697,4x4 Offroad Driving 3D,Simulation,i6 Games,3.7,3D Plane Flying Parking Simulator Game - Real Airplane Driving Test Run Sim Racing Games,Hybrid Touch Games Limited,Hybrid Touch Games Limited,3.81887,0
1214,9857,9857,a1679,b1061,Angry Birds Rio,Arcade,Rovio Entertainment Ltd.,4.4,Angry Birds Star Wars II,Action,Rovio Entertainment Ltd,4.42187,0
492,6219,6219,a1288,b511,Ace Fishing: Wild Catch,Sports,Com2uS USA,4.3,Ace Fishing: Wild Catch,Action,"Com2uS USA, Inc.",4.65,1
1909,16911,16911,a418,b1600,Monster Truck Destruction\u2122,Racing,ODD Games,4,Car Parking Driving Simulator Game - Real Monster Truck Test Drive Park Sim Racing Games,Play With Games Ltd,Play With Games Ltd,4.37015,0
1169,9658,9658,a1398,b1038,Soccer Stars,Sports,Miniclip.com,4.4,Soccer Stars,Sports,Miniclip.com,4.32667,1
2608,24547,24547,a1126,b2009,Pooza - FREE Puzzles for Kids,Education,ImagiRation LLC,4.5,Bike Race of Slender-man's Pages - Fun Kids (Girl &amp; Boy) Dirt Bike Racing Games (8+) Free,Entertainment,"Mega Rock, LLC",4.13793,0
3000,30434,30434,a3625,b2271,Baby puzzles & games for kids,Educational,Bimi Boo Kids - Games for boys and girls LLC,4.6,Baby Doctor Salon Spa Makeover Kid Games Free,Games,Fancy Quiz Games,3.76038,0
1342,10545,10545,a1940,b1156,Bike Racing 3D,Racing,Words Mobile,4.1,3D Parkour Freestyle Action Racing - Top Cool Rockstar Game For Awesome Boys Free,Music,uTappz Mobile Development LLC,4.31529,0
824,8442,8442,a3591,b758,Coloring games for kids animal,Casual,2bros - games for kids,4.3,My Dolphin Show: Pet animal game for girls &amp; kids,Family,SPIL GAMES,4.55556,0
3758,37012,37012,a588,b3057,Hearts Card Game FREE,Card,Breakout Games,4.3,Gummy Drop! Free Match 3 Puzzle Game,Inc,"Big Fish Games, Inc",4.5732,0
3614,36156,36156,a900,b2908,Papa's Pizzeria To Go!,Strategy,Flipline Studios,4.3,Papa's Freezeria To Go!,Strategy,Flipline Studios,4.17434,0
1481,13421,13421,a3214,b1277,Gus Learns Spanish for Kids,Education,"toojuice, LLC",4.7,3D Ginger-bread Christmas Running Game For Awesome Kid-s Free Version,Family,uTappz Mobile Development LLC,4.34579,0
1904,16848,16848,a1098,b1596,Train Games for Kids: Puzzles,Education,Scott Adelman Apps Inc,3.8,Motorcycle Games - motocross bike games for free,Entertainment,Falcon Mobile Inc.,10149 Ratings,0
3216,33632,33632,a2203,b2523,Restaurant Story: Tropic Bliss,Casual,Storm8 Studios,4.3,Restaurant Story 2,Family,Storm8 Studios,4.20132,0
4202,43262,43262,a1102,b3596,Chuggington: Kids Train Game,Casual,Budge Studios,3.9,My New Baby Story - Makeup Spa &amp; Dressup Kids Game,Family,Kids Games Studios LLC,2.4,0
4058,42160,42160,a188,b3466,4 Fotos 1 Palabra,Word,LOTUM GmbH,4.4,4 Pics 1 Word,Word,LOTUM GmbH,4.31496,0
3792,37135,37135,a107,b3073,Clash Royale,Strategy,Supercell,4.5,Clash Royale,Strategy,Supercell,4.29331,1
1024,9275,9275,a365,b942,Farm Heroes Super Saga Match 3,Casual,King,4.4,Farm Heroes Super Saga,Arcade,King,4.56379,0
2461,22429,22429,a679,b1911,Kids Trucks: Puzzles,Education,Scott Adelman Apps Inc,4.1,Kids Learning Puzzles: The Family Handyman - Tangram Building Blocks Make Your Brain Pop,Dice,Swipea Kids Apps,14 Ratings,0
592,7199,7199,a2656,b576,TX Poker - Texas Holdem Poker,Card,Murka Ltd.,4.4,World Series of Poker - WSOP Free Texas Holdem,Entertainment,Playtika LTD,4.39811,0
3593,36084,36084,a577,b2868,Real Steel World Robot Boxing,Action,Reliance Big Entertainment (UK) Private Limited,4.4,Real Steel World Robot Boxing,Sports,Reliance Big Entertainment UK Private Ltd,4.45774,1
3870,38997,38997,a1120,b3188,Savanna - Coloring Games Kids,Educational,MagisterApp - Educational Games for kids,3.9,Christmas Food Fever Cooking Maker Kids Games,Fancy Quiz Games,Fancy Quiz Games,3.82545,0
2022,18009,18009,a412,b1659,Mad Truck Challenge Racing,Racing,Spil Games,4.2,Ferry Port Car Parking Simulator - Real Monster Bus Driving Test Truck Racing Run Race Games,Play With Games Ltd,Play With Games Ltd,4.45293,0
1107,9479,9479,a2348,b994,Angry Birds Seasons,Arcade,Rovio Entertainment Ltd.,4.3,Angry Birds Blast,Puzzle,Rovio Entertainment Ltd,4.62446,0
3226,33729,33729,a2455,b2550,Sniper Shooter Free - Fun Game,Action,Fun Games For Free,4.5,Flight Alert : Impossible Landings Flight Simulator by Fun Games For Free,Arcade,Fun Games For Free,4.79976,0
2508,23086,23086,a2648,b1950,Slot Machine,Casino,LinkDesks Inc.,4.6,"Slots Lost Treasure Journey Slot Machine Games - Win Progressive Chips, 777 Wild Cherries, and Bonus Jackpots in the Best Lucky VIP Macau Casino Bonanza!",Entertainment,"Rocket Speed, Inc.",4.67919,0
3420,35131,35131,a1250,b2711,TAP SPORTS BASEBALL,Sports,Glu,3.9,Tap Sports Football,Sports,Glu Games Inc,3.9375,0
1797,16342,16342,a94,b1551,Bike Race Free Motorcycle Game,Racing,Top Free Games.,4.5,Mouse Maze Free - Top Brain Puzzle Game,Games,Top Free Games,4.06959,0
4198,43245,43245,a3774,b3596,My Newborn Baby Care Madness,Casual,Baca Baca Games,3.7,My New Baby Story - Makeup Spa &amp; Dressup Kids Game,Family,Kids Games Studios LLC,2.4,0
127,1906,1906,a2015,b178,World of Dragons: Simulator,Simulation,Gluten Free Games,4.1,Lux Touch - risk of world war game,Games,Sillysoft Games,4.17722,0
3862,38607,38607,a3236,b3171,Snake Fun Game,Casual,Pixotri Technologies Pvt Ltd,4.1,Colorin - The fun free coloring in book logo quiz game for adults,Entertainment,Poptacular Ltd,4.28571,0
4123,42668,42668,a1214,b3528,Punch Hero,Sports,GAMEVIL Inc.,4.4,Punch Hero,Role Playing,"GAMEVIL USA, Inc.",4.21917,1
2437,22136,22136,a3531,b1888,Kids Preschool Puzzles,Educational,Intellijoy Educational Games for Kids,4.6,Kids Learning Puzzles: Farm Animals - Tangrams for K12,Books,Swipea Kids Apps,48 Ratings,0
403,5354,5354,a2644,b447,Slots Vacation - FREE Slots,Casino,Scopely,4.2,Slots Vacation - Free Slot Machines,Casino,Scopely,8685 Ratings,0
150,2402,2402,a668,b207,Governor of Poker 2 - OFFLINE,Card,Youda Games Holding B.V.,4.3,Governor of Poker LITE,Entertainment,Youda Games Holding B.V.,4.29411,0
4229,43508,43508,a998,b3630,School of Dragons,Role Playing,"Knowledge Adventure, Inc.",4,School of Dragons: How to Train Your Dragon,Adventure,Knowledge Adventure,4.22945,0
2394,21090,21090,a679,b1855,Kids Trucks: Puzzles,Education,Scott Adelman Apps Inc,4.1,"Kids Learning Puzzles: Transport &amp; Vehicles, Tangram Building Blocks Make My Brain Pop",Dice,Swipea Kids Apps,37 Ratings,0
1437,12832,12832,a2579,b1252,FINAL FANTASY,Casual,"SQUARE ENIX Co.,Ltd.",4.1,THEATRHYTHM FINAL FANTASY,Music,SQUARE ENIX INC,2.67232,0
1629,15533,15533,a1197,b1426,The Room Two,Puzzle,Fireproof Games,4.9,The Room Pocket,Games,Fireproof Games,4.62472,0
3859,38437,38437,a3627,b3168,Kids Learn Shapes FREE,Educational,Intellijoy Educational Games for Kids,3.8,Preschool &amp; Kindergarten learning kids games free,Educational Books,"Kids Academy Co apps: Preschool &amp; Kindergarten Learning Kids Games, Educational Books, Free Songs",4.66667,0
2442,22254,22254,a61,b1900,Rise of the Kings,Strategy,ONEMT Ltd,4.3,Backgammon Lord of the Board Free Backgammon,Board,Beach Bum Ltd,4.5,0
62,479,479,a1129,b45,Kids doodle games for toddlers,Educational,Bimi Boo Kids - Games for boys and girls LLC,4.2,Christmas Games - Santa Claus Toy Party for kids,Education,Tiltan Games (2013) LTD,139 Ratings,0
2336,19758,19758,a3393,b1817,Dinosaur Kids Connect the Dots,Educational,Tiltan Games,3.8,Pop Dots Jam Family Game for Kids of All Ages,LLC,"Uberapps: The Best Top Free Addictive Casual Tap Games, LLC",874 Ratings,0
2256,19335,19335,a1576,b1800,Angry Birds Go!,Racing,Rovio Entertainment Ltd.,4.2,Angry Birds Go!,Arcade,Rovio Entertainment Ltd,3.55211,1
2544,23844,23844,a3627,b1971,Kids Learn Shapes FREE,Educational,Intellijoy Educational Games for Kids,3.8,Teenage Ninja Run &amp; Jump Mobile - Fun 3D Kids Games Free,Entertainment,"Anarchy Arcade Free Games &amp; Apps, LLC",3.79921,0
2400,21116,21116,a3625,b1855,Baby puzzles & games for kids,Educational,Bimi Boo Kids - Games for boys and girls LLC,4.6,"Kids Learning Puzzles: Transport &amp; Vehicles, Tangram Building Blocks Make My Brain Pop",Dice,Swipea Kids Apps,37 Ratings,0
95,1051,1051,a3622,b113,Shapes and Colors for babies,Educational,Bimi Boo Kids - Games for boys and girls LLC,4.5,"Hammer Fruit - Free Smash Kids Game for iPhone, iPad and iPod touch",Arcade,"T-bone, LLC",3.77295,0
3109,32102,32102,a3138,b2374,Where's My Water?,Puzzle,Disney,4.7,Where's My Mickey? Free,Puzzle,Disney,3.79347,0
959,8914,8914,a523,b884,KIM KARDASHIAN: HOLLYWOOD,Adventure,Glu,4.3,Kim Kardashian: Hollywood,Entertainment,Glu Games Inc,4.64878,1
2191,19105,19105,a94,b1764,Bike Race Free Motorcycle Game,Racing,Top Free Games.,4.5,Car Race by Fun Games For Free,Racing,Fun Games For Free,4.60419,0
3461,35365,35365,a1895,b2747,MEGA MOTO RACING 3D,Racing,Foose Games,3.9,3D Police Drag Racing Driving Simulator Game: Race The Real Turbo Chase,Games,Mountain Wizard Games,4.3091,0
3230,33752,33752,a1129,b2550,Kids doodle games for toddlers,Educational,Bimi Boo Kids - Games for boys and girls LLC,4.2,Flight Alert : Impossible Landings Flight Simulator by Fun Games For Free,Arcade,Fun Games For Free,4.79976,0
3641,36331,36331,a1275,b2930,NBA Flip - Official game,Sports,FROM THE BENCH,4,NBA General Manager 2017: All-Star game,Sports,"From The Bench, SL",7228 Ratings,0
1576,15299,15299,a1764,b1383,Cut the Rope: Time Travel,Puzzle,ZeptoLab,4.5,Cut the Rope: Experiments,Puzzle,ZeptoLab UK Limited,none,0
3581,35978,35978,a2207,b2846,Restaurant Story: Fast Food,Casual,TeamLava Games,4.2,Food Court Fever: Super Chef Restaurant Scramble,Entertainment,FlowMotion Entertainment: Top Free Fun Addictive Cool Games Inc,4.5614,0
3285,33981,33981,a2411,b2600,Daddy Long Legs,Arcade,Set Snail,4.2,Daddy Long Legs,Arcade,Set Snail,4.37096,1
2153,18950,18950,a3637,b1718,Fast Car Parking,Simulation,Defne Games,4.2,Roof Jumping Stunt Driving Parking Simulator - Real Car Racing Test Sim Run Race Games,Play With Games Ltd,Play With Games Ltd,4.38783,0
236,3643,3643,a2664,b304,Vegas Jackpot Slots Casino,Casino,Rocket Speed - Casino Slots Games,4.6,Triple Double Jackpot Slots Free Slot Games Casino,Entertainment,"Rocket Speed, Inc.",4.84327,0
222,3503,3503,a1299,b293,Jurassic World\u2122: The Game,Simulation,Ludia Inc.,4.1,Skip-Bo - The Classic Family Card Game Now Free!,Card,Magmic Inc.,2.53252,0
4179,43137,43137,a998,b3587,School of Dragons,Role Playing,"Knowledge Adventure, Inc.",4,SpellCraft School of Magic,Role Playing,"Appy Entertainment, Inc.",4.0869,0
2393,21074,21074,a3625,b1853,Baby puzzles & games for kids,Educational,Bimi Boo Kids - Games for boys and girls LLC,4.6,Dentist Games of Ninja - Fun Kids Games for Boys &amp; Girls,Entertainment,"Mega Rock, LLC",2.5,0
1810,16387,16387,a1617,b1557,Toy Blast,Puzzle,Peak Games,4.6,Toy Blast,Games,Peak Games,4.71785,1
120,1801,1801,a3361,b176,Hedgehog's Adventures for kids,Educational,Irina Marina,4.3,Memory matches brain trainer matching preschool toddler childrens educational training and match learning games for kids boys and girls for free,Education,Irina Schens,3.84896,0
1685,15797,15797,a2624,b1479,Ninja Kid Run Free - Fun Games,Action,Fun Games For Free,4.1,Where's My Head? Free by Top Free Games,Top Free Games,Top Free Games,4.15278,0
2636,25113,25113,a3736,b2039,Temple Unicorn Run 3D,Casual,Kids Dreams Games,4.5,Ninja Run Multiplayer 3D Racing: Free Racing Games,Sizzle Entertainment: The Best Fun Free Cool Apps and Top Addicting Games,Sizzle Entertainment: The Best Fun Free Cool Apps and Top Addicting Games,4.44761,0
4305,44069,44069,a3706,b3697,Fairy Farm - Games for Girls,Casual,Game Garden\u2122,4.3,"Princess Salon 2 - Makeup, Dressup, Spa and Makeover - Girls Beauty Salon Games",Libii Girls Game,Libii Girls Game,4.14522,0
2380,20715,20715,a2799,b1845,The Mystery of Crimson Manor,Adventure,MediaCity Games LLC,3.9,Slots of the Caribbean Free,Entertainment,Avalinx LLC,829 Ratings,0
3134,32689,32689,a1190,b2415,Draw Something,Word,OMGPOP,4,Draw Something,Word,OMGPOP,361119 Ratings,1
2639,25121,25121,a2038,b2039,Flight Pilot Simulator 3D Free,Simulation,Fun Games For Free,4.6,Ninja Run Multiplayer 3D Racing: Free Racing Games,Sizzle Entertainment: The Best Fun Free Cool Apps and Top Addicting Games,Sizzle Entertainment: The Best Fun Free Cool Apps and Top Addicting Games,4.44761,0
193,2919,2919,a2684,b265,Casino Slots,Casino,Mouse Games,4,OMG! Fortune Free Slots Play Vegas Casino Games!,Games,LuckyFish Games,786 Ratings,0
2283,19406,19406,a2647,b1810,The Price is Right\u2122 Slots,Casino,Ludia Inc.,4.2,Tiger King Casino Slots: The Lucky Asian Las Vegas Slots Journey Bonanza,Casino,"Rocket Speed, Inc.",4.79097,0
181,2836,2836,a2712,b256,Slots Lost Treasure Slot Games,Casino,Rocket Speed - Casino Slots Games,4.4,Slots Games - Free Casino Slot Machines,Casino,Huuuge Games Sp. z o.o.,2.875,0
4091,42328,42328,a2914,b3484,Happy Kids: Baby Shapes 2-5,Educational,Oriplay Games,4.3,New Baby Sister - Girls Newborn Salon Kids Games,Kids Games Studios LLC,Kids Games Studios LLC,2.59999,0
389,5276,5276,a2788,b442,Rolling Sky,Board,Cheetah Games,4.5,Rolling Sky,Music,Cheetah Technology Corporation Limited,4.51656,1
968,8986,8986,a835,b894,Call of Mini\u2122 Infinity,Arcade,Triniti Interactive Ltd.,4.1,Call of Mini Zombies,Action,Triniti Interactive Limited,4.57477,0
3721,36842,36842,a756,b3021,Bike Race Pro by T. F. Games,Racing,Top Free Games.,4.7,Zombie Tower Shooting Defense Free - by Top Free Games,Top Free Games,Top Free Games,4.69363,0
1545,14968,14968,a2453,b1353,Geometry Dash Lite,Arcade,RobTop Games,4.5,Geometry Dash,Entertainment,RobTop Games AB,4.65435,0
669,7650,7650,a1207,b629,Archery King,Sports,Miniclip.com,4.5,Archery King,Sports,Miniclip.com,4.30281,1
4110,42426,42426,a3597,b3499,Jigsaw Puzzle Games for Kids,Educational,KidZone Studios,4.3,Baby Doctor Office - Kids Spa Games (Boys &amp; Girls),Family,Ninjafish Studios,343 Ratings,0
3808,37791,37791,a1482,b3110,Guess the GIF,Trivia,"Random Logic Games, LLC",4.3,Logo Quiz - Guess the Brand Trivia Free Word Games,Mediaflex Games,Mediaflex Games,3.73,0
3825,38048,38048,a1501,b3126,Guess the Word,Word,"Random Logic Games, LLC",4.2,Guess the Sneakers - Kicks Quiz for Sneakerheads,Inc.,"Tapgang Apps and Games, Inc.",3,0
4225,43496,43496,a1361,b3627,Big Win Football 2016,Sports,Hothead Games,4,Big Win Soccer,Sports,Hothead Games Inc.,4.28571,0
3454,35327,35327,a420,b2747,3D Monster Truck Parking Game,Racing,Play With Games,3.9,3D Police Drag Racing Driving Simulator Game: Race The Real Turbo Chase,Games,Mountain Wizard Games,4.3091,0
1365,11087,11087,a1482,b1178,Guess the GIF,Trivia,"Random Logic Games, LLC",4.3,Song Duel - Guess the songs and artists! Multiplayer music trivia game.,Entertainment,W8 LLC,3.23529,0
1394,11862,11862,a3124,b1223,Surprise Eggs - Kids App,Casual,Thom&Co Apps,3.8,Tap Dance Troll Style - Relax with the Best Fun and Cool Free Music Game App for Kids and Family,Music,Asnis Apps,4.11111,0
331,4754,4754,a2673,b400,Slots Casino Games God of Sky,Casino,Free Slots & Casino games by Huuuge,4.6,Jackpot City Slots Free Casino Slot Tournaments,Inc,"Big Fish Games, Inc",4.57735,0
614,7404,7404,a2689,b587,Lucky Win Casino\u2122- FREE SLOTS,Casino,ZENTERTAIN LTD,4.3,Slotomania Casino Slots Games - Free Slot Machines,Casino,Playtika LTD,4.22403,0
1286,10153,10153,a2414,b1113,Paper Toss Boss,Arcade,"Backflip Studios, Inc.",4.2,Paper Toss,Entertainment,Backflip Studios,4.18966,0
3078,31751,31751,a1129,b2337,Kids doodle games for toddlers,Educational,Bimi Boo Kids - Games for boys and girls LLC,4.2,"Makeup Girls - Make Up &amp; Beauty Salon games for girls, by Pazu",Educational,Pazu Games Ltd,4.03071,0
266,3869,3869,a1442,b334,Words With Friends Classic,Word,Zynga,4.3,Matching With Friends Free,Puzzle,Zynga Inc.,4.12,0
3110,32103,32103,a1204,b2374,Where's My Perry?,Puzzle,Disney,4.6,Where's My Mickey? Free,Puzzle,Disney,3.79347,0
1932,17056,17056,a2624,b1609,Ninja Kid Run Free - Fun Games,Action,Fun Games For Free,4.1,3D Sports Cars Parking Simulator Racing Game ~ Real Driving Test Run Park Sim Games,Play With Games Ltd,Play With Games Ltd,4.03095,0
2199,19147,19147,a3621,b1764,Birthday party: Games for kids,Educational,Preschool & Kindergarten Learning Kids Games,4,Car Race by Fun Games For Free,Racing,Fun Games For Free,4.60419,0
2593,24413,24413,a1114,b2002,Peekaboo Kids - Free Kids Game,Education,Tappy Happy kids apps & games for kids,3.8,Color Bubbles Pop Mania - Cute Fun Simple Silly Boys and Girls Game (Free HD Kids Games),Games,Top Action Games,4.23112,0
3190,33324,33324,a2506,b2485,Princess memory game for kids,Board,Owlet games for kids,3.8,Block Craft 3D: Building Simulator Game For Free,Adventure,Fun Games For Free,4.76736,0
1807,16376,16376,a1856,b1554,Wood Block Puzzle,Puzzle,BitMango,4.5,Block! Hexa Puzzle,Board,BitMango,4.30809,0
225,3522,3522,a2496,b296,MONOPOLY HERE & NOW,Board,Hasbro Inc.,3.9,MONOPOLY HERE &amp; NOW,Family,"Hasbro, Inc.",3.96078,0
105,1304,1304,a871,b138,Defenders: TD Origins,Strategy,Nival,4.3,Defenders: Tower Defense Origins,Card,"NIVAL, INC.",4.41176,0
2413,21336,21336,a3236,b1864,Snake Fun Game,Casual,Pixotri Technologies Pvt Ltd,4.1,Rope And Swing Parkour Stick-man - Super Fun Run And Jump Kid Game FREE,Action,Combinatrix Ltd,2.63218,0
1508,13999,13999,a2217,b1293,BEAT MP3 for YouTube,Music,"CREAPPTIVE Co., Ltd.",4.5,BEAT MP3 - Rhythm Game,Action,CREAPPTIVE Inc.,4.57143,0
4269,43926,43926,a2600,b3679,Zombie Highway 2,Action,Auxbrain Inc,4.3,Zombie Farm 2,Role Playing,Behaviour Interactive Inc.,4.29891,0
630,7524,7524,a95,b602,Cut the Rope 2,Puzzle,ZeptoLab,4.3,Cut the Rope: Time Travel Free,Entertainment,ZeptoLab UK Limited,4.25,0
2731,26198,26198,a2301,b2073,Dress Up - Doll Salon,Casual,Libii,4,Dress Up - Christmas Girls,Educational,Libii Tech Limited,4.06667,0
2068,18248,18248,a1133,b1680,Coloring book for kids,Educational,Bimi Boo Kids - Games for boys and girls LLC,4.2,Ninja Revinja Free - Real Uber Racing Run for Kids,Games,Sizzle Entertainment: The Best Fun Free Cool Apps and Top Addicting Games,4.32258,0
870,8640,8640,a1728,b820,Escape game : Limited Time,Adventure,Gameday Inc.,4,Escape game : Doors&amp;Rooms,Adventure,gameday Inc.,4.4036,0
2290,19457,19457,a2624,b1812,Ninja Kid Run Free - Fun Games,Action,Fun Games For Free,4.1,Parking Games Dino - Real Car Racing &amp; Driving Games Simulator Free,Dice,"Anarchy Arcade Free Games &amp; Apps, LLC",3.33333,0
2098,18553,18553,a2976,b1693,Jet Ski Driving Simulator 3D 2,Racing,parking games,4.5,3D Police Drag Racing Driving Simulator Game: Race The Real Turbo Chase,Games,Mountain Wizard Games,4.3091,0
1186,9678,9678,a3246,b1044,Disney Crossy Road,Arcade,Disney,4.5,Disney Crossy Road,Arcade,Disney,4.55753,1
2963,30059,30059,a1523,b2251,Trivia Crack (Ad free),Trivia,Etermax,4.6,Trivia Crack (Ad Free),Entertainment,Etermax,none,1
2489,22949,22949,a2624,b1946,Ninja Kid Run Free - Fun Games,Action,Fun Games For Free,4.1,`Baby Corn Run Race Free - Easy Kids Jump Chase Racing by Top Crazy Games,Top Crazy Games LLC,Top Crazy Games LLC,3.46429,0
1891,16692,16692,a418,b1591,Monster Truck Destruction\u2122,Racing,ODD Games,4,Monster Truck by Fun Games For Free,Arcade,Fun Games For Free,4.49278,0
1755,16094,16094,a1839,b1528,Gems of War - Match 3 RPG,Puzzle,505 Games Srl,4.2,Gummy Drop! Free Match 3 Puzzle Game,Inc,"Big Fish Games, Inc",4.57273,0
1926,16991,16991,a1947,b1601,Motorbike Driving Simulator 3D,Racing,Pudlus Games,3.8,Super Sports Car Parking Simulator - Real Driving Test Sim Racing Games,Play With Games Ltd,Play With Games Ltd,4.43713,0
707,7730,7730,a641,b647,Injustice: Gods Among Us,Action,Warner Bros. International Enterprises,4.4,Injustice: Gods Among Us,Entertainment,Warner Bros.,4.66018,1
3672,36627,36627,a2624,b2978,Ninja Kid Run Free - Fun Games,Action,Fun Games For Free,4.1,Infection 2 Bio War Simulation by Fun Games For Free,Strategy,Fun Games For Free,4.60787,0
3981,41270,41270,a15,b3381,Four Letters,Word,PIKPOK,4.4,Four Letters,Word,PikPok,4.37764,1
2870,28463,28463,a3416,b2159,Teddy - Coloring book for kids,Casual,Teddy Apps,4.9,Animal Games for Kids: Puzzles HD,Educational,Scott Adelman Apps Inc,4.11582,0
2349,19994,19994,a3214,b1824,Gus Learns Spanish for Kids,Education,"toojuice, LLC",4.7,Car Games of Real Asphalt - Racing and Driving Simulator for Boys &amp; Kids (8+) Free,Racing,"Mega Rock, LLC",3.65,0
2220,19220,19220,a1731,b1785,Angry Birds Star Wars HD,Arcade,Rovio Entertainment Ltd.,4.2,Angry Birds Transformers,Action,Rovio Entertainment Ltd,3.43902,0
1688,15823,15823,a302,b1482,Cut the Rope FULL FREE,Puzzle,ZeptoLab,4.3,Cut the Rope: Time Travel Free,Entertainment,ZeptoLab UK Limited,4.25,0
284,4356,4356,a1195,b370,Word Streak:Words With Friends,Word,Zynga,4.5,Chess With Friends Free,Strategy,Zynga Inc.,4.1898,0
1659,15679,15679,a1501,b1452,Guess the Word,Word,"Random Logic Games, LLC",4.2,Guess The 90's!,Puzzle,"Conversion, LLC",4.03251,0
3306,34219,34219,a1929,b2632,Extreme Car Driving Simulator,Racing,AxesInMotion Racing,4.2,Extreme Car Driving Simulator Free,Simulation,AxesInMotion S.L.,4.36318,0
920,8794,8794,a588,b861,Hearts Card Game FREE,Card,Breakout Games,4.3,Block Craft 3D: Building Simulator Game For Free,Adventure,Fun Games For Free,4.76628,0
1433,12827,12827,a833,b1252,FINAL FANTASY DIMENSIONS,Role Playing,"SQUARE ENIX Co.,Ltd.",4.3,THEATRHYTHM FINAL FANTASY,Music,SQUARE ENIX INC,2.67232,0
3911,39745,39745,a3118,b3236,Word Search,Word,MetaFun Games,4.5,Word Crush - Word Search Brain Training Free Games,Mediaflex Games,Mediaflex Games,4.09293,0
3679,36652,36652,a255,b2981,Maleficent Free Fall,Puzzle,Disney,4.3,Maleficent Free Fall,Strategy,Disney,4.72989,1
734,7785,7785,a88,b658,Bike Racing : Off road,Racing,Racing Games Android,3.8,Bike Race Free - Top Motorcycle Racing Game,Games,Top Free Games,4.7812,0
