,Unnamed: 0,_id,ltable_ID,rtable_ID,ltable_name,ltable_category,ltable_developer,ltable_rating,rtable_name,rtable_category,rtable_developer,rtable_rating,label
2515,23226,23226,a1133,b1954,Coloring book for kids,Educational,Bimi Boo Kids - Games for boys and girls LLC,4.2,Fun Stunt Kids E-Xtreme BMX Smackdown - Best Dirt Bike Games for Boys &amp; Girls Free,Entertainment,"Mega Rock, LLC",4.24705,0
4165,43061,43061,a2305,b3568,Top Stylist,Casual,Crowdstar Inc,3.3,Top Stylist - the fashion game,Role Playing,Crowdstar Inc,3.21458,0
3371,34776,34776,a420,b2682,3D Monster Truck Parking Game,Racing,Play With Games,3.9,Quarry Driver Parking Game - Real Mining Monster Truck Car Driving Test Park Sim Racing Games,Play With Games Ltd,Play With Games Ltd,4.30739,0
1843,16443,16443,a1862,b1571,Unblock Me FREE,Puzzle,"Kiragames Co., Ltd.",4.3,Unblock Me FREE,Puzzle,"Kiragames Co., Ltd.",4.75386,1
3308,34222,34222,a1957,b2632,Extreme Racing SUV Simulator,Racing,AxesInMotion Racing,3.9,Extreme Car Driving Simulator Free,Simulation,AxesInMotion S.L.,4.36318,0
1466,13146,13146,a2455,b1270,Sniper Shooter Free - Fun Game,Action,Fun Games For Free,4.5,Free Stickly Jump Game,LLC,"Best Free and Fun Games, LLC",3.98675,0
319,4672,4672,a2692,b391,Okey Extra - Gin Rummy Online,Board,Digitoy Games,4.8,Gin Rummy Plus - Free Online Card Game,Games,Peak Games,4.46865,0
184,2841,2841,a2735,b256,Casino Games - Cleopatra Slots,Casino,Free Slots & Casino games by Huuuge,4.5,Slots Games - Free Casino Slot Machines,Casino,Huuuge Games Sp. z o.o.,2.875,0
4261,43850,43850,a102,b3672,The Walking Dead No Man's Land,Strategy,Next Games Oy,4.5,The Walking Dead: No Man's Land,Role Playing,Next Games Oy,3.95238,0
3127,32640,32640,a1778,b2403,COOKING MAMA Let's Cook\uff01,Educational,Office Create Corp.,4.2,COOKING MAMA Let's Cook,Education,Office Create Corp.,4.26471,0
3100,32007,32007,a2355,b2362,Hoppy Frog,Casual,Turbo Chilli,4.2,Hoppy Frog,Family,Turbo Chilli Pty Ltd,4.59256,1
3005,30523,30523,a1129,b2275,Kids doodle games for toddlers,Educational,Bimi Boo Kids - Games for boys and girls LLC,4.2,Pet Foot Doctor Salon - Games for Kids Free,Educational,App Whisperer LLC,3.57037,0
3255,33851,33851,a144,b2576,CarX Drift Racing,Racing,CarX Technologies,4.5,CarX Drift Racing,Racing,CarX Technologies,4.22581,1
2028,18018,18018,a756,b1659,Bike Race Pro by T. F. Games,Racing,Top Free Games.,4.7,Ferry Port Car Parking Simulator - Real Monster Bus Driving Test Truck Racing Run Race Games,Play With Games Ltd,Play With Games Ltd,4.45293,0
839,8529,8529,a453,b775,Pocket Mortys,Simulation,[adult swim] games,4.5,Rick and Morty: Pocket Mortys,Entertainment,[adult swim],4.70076,0
3982,41274,41274,a126,b3382,PowerVocab Word Game,Educational,Trymph Inc.,3.9,Word Chums - The Exclusive Crossword Puzzle Game,Board,"PeopleFun, Inc.",4.87125,0
2792,27400,27400,a989,b2110,Kids Shapes & Colors Preschool,Educational,Intellijoy Educational Games for Kids,4.1,Preschool &amp; Kindergarten learning kids games free,Educational Books,"Kids Academy Co apps: Preschool &amp; Kindergarten Learning Kids Games, Educational Books, Free Songs",4.66667,0
539,6699,6699,a1087,b542,MARVEL Future Fight,Role Playing,Netmarble Games,4.6,MARVEL Future Fight,Action,Netmarble Games Corp.,4.13019,1
1154,9579,9579,a1731,b1034,Angry Birds Star Wars HD,Arcade,Rovio Entertainment Ltd.,4.2,Angry Birds POP! - Bubble Shooter,Puzzle,Rovio Entertainment Ltd,4.32645,0
801,8264,8264,a812,b733,Grand Theft Auto: San Andreas,Action,Rockstar Games,4.4,Grand Theft Auto: San Andreas,Games,Rockstar Games,none,1
2245,19291,19291,a1957,b1793,Extreme Racing SUV Simulator,Racing,AxesInMotion Racing,3.9,Extreme Car Driving Simulator Free,Simulation,AxesInMotion S.L.,4.36311,0
3586,36044,36044,a62,b2855,VEGA Conflict,Strategy,KIXEYE,4.2,VEGA Conflict,Action,KIXEYE,4.34375,1
1135,9544,9544,a1600,b1020,Looney Tunes Dash!,Casual,Zynga,4.2,Looney Tunes Dash!,Action,Zynga Inc.,3.98795,1
210,3053,3053,a2676,b276,Fresh Deck Poker - Live Holdem,Casino,"GSN Games, Inc.",4.3,Zynga Poker Classic Texas Holdem,Entertainment,Zynga Inc.,4.25641,0
3303,34216,34216,a1880,b2632,Racing Car Driving Simulator,Racing,AxesInMotion Racing,3.9,Extreme Car Driving Simulator Free,Simulation,AxesInMotion S.L.,4.36318,0
2512,23109,23109,a2745,b1950,GSN Casino: Free Slot Machines,Casino,"GSN Games, Inc.",4.3,"Slots Lost Treasure Journey Slot Machine Games - Win Progressive Chips, 777 Wild Cherries, and Bonus Jackpots in the Best Lucky VIP Macau Casino Bonanza!",Entertainment,"Rocket Speed, Inc.",4.67919,0
65,491,491,a3258,b45,Animals Farm For Kids,Educational,Kids Games Projects,4.2,Christmas Games - Santa Claus Toy Party for kids,Education,Tiltan Games (2013) LTD,139 Ratings,0
863,8594,8594,a1712,b810,The Trail,Simulation,Kongregate,4.4,The Trail,Adventure,Kongregate,4.05691,1
3333,34268,34268,a1296,b2649,The Sims\u2122 FreePlay,Simulation,ELECTRONIC ARTS,4.3,The Sims FreePlay,Simulation,Electronic Arts,4.22563,0
3079,31752,31752,a1135,b2337,Dino Puzzle Games for Kids,Puzzle,Tiltan Games,4,"Makeup Girls - Make Up &amp; Beauty Salon games for girls, by Pazu",Educational,Pazu Games Ltd,4.03071,0
4249,43729,43729,a2332,b3662,Covet Fashion - Dress Up Game,Casual,Crowdstar Inc,4.1,"Fashion Star Boutique - Design, Style, Dress",Entertainment,XMG Studio Inc.,4.0155,0
1132,9514,9514,a1682,b1007,Angry Birds,Arcade,Rovio Entertainment Ltd.,4.4,Angry Birds Friends,Arcade,Rovio Entertainment Ltd,4.47857,0
3423,35158,35158,a577,b2723,Real Steel World Robot Boxing,Action,Reliance Big Entertainment (UK) Private Limited,4.4,Real Steel Robot Boxing Champions,Sports,Reliance Big Entertainment UK Private Ltd,4.54687,0
1026,9277,9277,a1423,b944,NBA JAM by EA SPORTS\u2122,Sports,ELECTRONIC ARTS,4.3,NBA JAM by EA SPORTS,Entertainment,Electronic Arts,3.59003,0
2328,19731,19731,a1114,b1817,Peekaboo Kids - Free Kids Game,Education,Tappy Happy kids apps & games for kids,3.8,Pop Dots Jam Family Game for Kids of All Ages,LLC,"Uberapps: The Best Top Free Addictive Casual Tap Games, LLC",874 Ratings,0
341,4840,4840,a1361,b404,Big Win Football 2016,Sports,Hothead Games,4,Big Win Hockey,Sports,Hothead Games Inc.,4.16249,0
3780,37071,37071,a2144,b3061,Make It Rain: Love of Money,Casual,"Space Inch, LLC",4.1,Make It Rain: The Love of Money,Strategy,"Space Inch, LLC",26362 Ratings,0
875,8648,8648,a2529,b823,CONTRACT KILLER 2,Action,Glu,4.3,Contract Killer 2,Entertainment,Glu Games Inc,4.27077,1
1506,13877,13877,a3625,b1289,Baby puzzles & games for kids,Educational,Bimi Boo Kids - Games for boys and girls LLC,4.6,A Gymnastic Girls Fun Game - Girly Girl Gymnastics Games For Teen &amp; Kids Free,Music,uTappz Mobile Development LLC,2.13513,0
372,5083,5083,a793,b426,Battle for the Galaxy,Strategy,AMT Games,4.2,Solitaire 2.0 -Play the Classic Card Game for Free,Games,Parconia Games,4.35526,0
2624,24986,24986,a2613,b2029,Roulette - Casino Style!,Casino,RNF Technologies Pvt Ltd,4,Roulette - Casino Style,Casino,Rnf Technologies,4.8419,0
2259,19338,19338,a2226,b1800,Angry Birds Fight! RPG Puzzle,Puzzle,Rovio Entertainment Ltd.,4.3,Angry Birds Go!,Arcade,Rovio Entertainment Ltd,3.55211,0
2568,24036,24036,a2716,b1986,Slots Lucky Wolf Casino Slots,Casino,Rocket Speed - Casino Slots Games,4.4,Slots Games - Free Casino Slot Machines,Casino,Huuuge Games Sp. z o.o.,2.875,0
889,8722,8722,a636,b851,FRONTLINE COMMANDO: WW2,Action,Glu,4.2,Frontline Commando,Entertainment,Glu Games Inc,4.28533,0
3928,40102,40102,a3648,b3253,Popping Wrap Game Free,Simulation,DPoisn LLC,2.8,FREE Hangman: The Ultimate Hang Man Challenge Game,Trivia,Boy Howdy Technology LLC,4.71429,0
3016,30680,30680,a1135,b2285,Dino Puzzle Games for Kids,Puzzle,Tiltan Games,4,"Makeup Girls - Wedding Dress Up &amp; Make Up Games for girls, by Pazu",Educational,Pazu Games Ltd,4.02412,0
3391,34980,34980,a2241,b2702,Pako - Car Chase Simulator,Racing,Tree Men Games,4.4,Gas Station Car Parking Simulator a Real Road Racing Park Game,Racing,Play With Games Ltd,4.1645,0
1325,10340,10340,a2455,b1146,Sniper Shooter Free - Fun Game,Action,Fun Games For Free,4.5,Auto Police Fast Speed 3D Car Chase - Free Racing Game,Games,Sixfeed Games,3.77027,0
2402,21156,21156,a406,b1860,Reversi Free - King of Games,Casual,Cross Field Inc.,4.3,Riches of Greece Free Casino Slots: An Epic Odyssey through Mount Olympus and Mythology with the Greek Gods,Casino,"Rocket Speed, Inc.",4.79221,0
3921,39886,39886,a1504,b3244,Guess The Emoji,Word,"Random Logic Games, LLC",4.4,Guess the Logos (World Brands and Logo Trivia Quiz Game),Word,"MigoApps, LLC",4.53332,0
96,1053,1053,a3625,b113,Baby puzzles & games for kids,Educational,Bimi Boo Kids - Games for boys and girls LLC,4.6,"Hammer Fruit - Free Smash Kids Game for iPhone, iPad and iPod touch",Arcade,"T-bone, LLC",3.77295,0
2985,30373,30373,a2268,b2261,Beauty Hair Salon: Fashion SPA,Educational,Bear Hug Media Inc,3.6,Beauty Salon - Girls Games,Bear Hug Media,Bear Hug Media,4.425,0
2637,25114,25114,a291,b2039,Treasure Hunt - Fun Games Free,Puzzle,Big Bear Entertainment,4.1,Ninja Run Multiplayer 3D Racing: Free Racing Games,Sizzle Entertainment: The Best Fun Free Cool Apps and Top Addicting Games,Sizzle Entertainment: The Best Fun Free Cool Apps and Top Addicting Games,4.44761,0
3063,31588,31588,a322,b2329,Animal Puzzles for kids free,Educational,SYNCROM ENTERTAINMENT,3.9,Fair Food Donut Maker - Games for Kids Free,Educational,VZO entertainment,3.94643,0
4139,42766,42766,a2579,b3545,FINAL FANTASY,Casual,"SQUARE ENIX Co.,Ltd.",4.1,FINAL FANTASY BRAVE EXVIUS,Role Playing,SQUARE ENIX INC,4.61956,0
129,1998,1998,a474,b186,Polar Bear Cub Free for kids,Educational,Irina Marina,4.2,Cat Kitten Kitty Pet Baby Animal JIgsaw Puzzle Games for Girls who love educational memory learning puzzles for kids and toddlers,Education,Irina Schens,4.53083,0
2561,24025,24025,a2646,b1986,Slots Free - Big Win Casino\u2122,Casino,FiveStar Games - Slots and Casino,4.3,Slots Games - Free Casino Slot Machines,Casino,Huuuge Games Sp. z o.o.,2.875,0
2119,18628,18628,a1304,b1697,Shift Racing 3D,Sports,ZTASTAR GAMES,4,3D Plane Flying Parking Simulator Game - Real Airplane Driving Test Run Sim Racing Games,Hybrid Touch Games Limited,Hybrid Touch Games Limited,3.81887,0
1635,15562,15562,a1439,b1430,Hanging With Friends,Word,Zynga,4.2,Gems With Friends Free,Entertainment,Zynga Inc.,3.375,0
1985,17566,17566,a1940,b1628,Bike Racing 3D,Racing,Words Mobile,4.1,Drag Racing: Bike Edition,Sports,Creative Mobile,4.30171,0
4239,43668,43668,a464,b3641,STARDOM: HOLLYWOOD,Adventure,Glu,4.2,Stardom: Hollywood,Entertainment,Glu Games Inc,4.63131,1
3440,35280,35280,a413,b2744,RC Truck Racing Simulator 3D,Racing,i6 Games,3.7,Police Car Parking Simulator Game - Real Life Emergency Driving Test Sim Racing Games,Play With Games Ltd,Play With Games Ltd,4.23465,0
4099,42349,42349,a3621,b3484,Birthday party: Games for kids,Educational,Preschool & Kindergarten Learning Kids Games,4,New Baby Sister - Girls Newborn Salon Kids Games,Kids Games Studios LLC,Kids Games Studios LLC,2.59999,0
3795,37205,37205,a1520,b3079,Guess The Movie \u00ae - Full,Trivia,June Software Inc,4.5,"Movie Trivia Quiz: Guess pop movie stars, actors, actresses. New fun puzzles!",Word,Innoge Labs Inc.,4.75846,0
370,5077,5077,a2773,b426,All-in-One Solitaire FREE,Card,Pozirk Games Inc.,4,Solitaire 2.0 -Play the Classic Card Game for Free,Games,Parconia Games,4.35526,0
1788,16273,16273,a3138,b1545,Where's My Water?,Puzzle,Disney,4.7,Where's My Water? 2,Entertainment,Disney,4.01976,0
2504,22993,22993,a3627,b1946,Kids Learn Shapes FREE,Educational,Intellijoy Educational Games for Kids,3.8,`Baby Corn Run Race Free - Easy Kids Jump Chase Racing by Top Crazy Games,Top Crazy Games LLC,Top Crazy Games LLC,3.46429,0
2773,27118,27118,a2914,b2102,Happy Kids: Baby Shapes 2-5,Educational,Oriplay Games,4.3,Triplet Baby Doctor Salon Spa Kids Games Free,Games,Free Addicting Games,3.61176,0
2116,18620,18620,a420,b1697,3D Monster Truck Parking Game,Racing,Play With Games,3.9,3D Plane Flying Parking Simulator Game - Real Airplane Driving Test Run Sim Racing Games,Hybrid Touch Games Limited,Hybrid Touch Games Limited,3.81887,0
1820,16404,16404,a1532,b1562,Boggle With Friends,Word,Zynga,4.4,Hanging With Friends Free,Puzzle,Zynga Inc.,171871 Ratings,0
994,9078,9078,a2022,b911,Sea Plane: Flight Simulator 3D,Simulation,i6 Games,3.8,Flight Alert : Impossible Landings Flight Simulator by Fun Games For Free,Arcade,Fun Games For Free,4.79976,0
881,8694,8694,a677,b838,Modern Combat 5 eSports FPS,Action,Gameloft,4.2,Modern Combat 5 : The Multiplayer eSports Shooter,Action,Gameloft,4.36953,0
737,7788,7788,a339,b658,Bike Mayhem Mountain Racing,Racing,Best Free Games Inc.,4.3,Bike Race Free - Top Motorcycle Racing Game,Games,Top Free Games,4.7812,0
231,3594,3594,a2735,b302,Casino Games - Cleopatra Slots,Casino,Free Slots & Casino games by Huuuge,4.5,Epic Jackpot Slots Casino: Free Slot Games,Super Lucky Casino Inc.,Super Lucky Casino Inc.,4.83221,0
377,5163,5163,a2664,b429,Vegas Jackpot Slots Casino,Casino,Rocket Speed - Casino Slots Games,4.6,SLOTS Downtown Deluxe - Free Classic Slot Casino,Entertainment,"Rocket Speed, Inc.",4.89473,0
3688,36679,36679,a2764,b3004,Fairway Solitaire Blast,Card,Big Fish Games,4.6,Fairway Solitaire,Inc,"Big Fish Games, Inc",4.72727,0
4112,42458,42458,a1967,b3500,Dear Diary - Interactive Story,Simulation,Tapps Games,4.2,Gossip Life - The Interactive Episode Story Game,Simulation,Top 10 Games Ltd,4.125,0
432,5560,5560,a2717,b471,myVEGAS Slots - Free Casino,Casino,PlayStudios,4.4,POP! Slots - Play Free Vegas Slots,Entertainment,PlayStudios,4.49206,0
1361,10975,10975,a3361,b1175,Hedgehog's Adventures for kids,Educational,Irina Marina,4.3,Pony Unicorn Memo Memories Matching Learning Kids Games for Girls and Toddlers,Education,Irina Schens,3.50658,0
3324,34259,34259,a2191,b2643,My Talking Angela,Casual,Outfit7,4.4,My Talking Tom,Entertainment,Outfit7 Limited,4.26376,0
1378,11313,11313,a2217,b1193,BEAT MP3 for YouTube,Music,"CREAPPTIVE Co., Ltd.",4.5,BEAT MP3 2.0 - Rhythm Game,Music,CREAPPTIVE Inc.,4.04,0
1591,15383,15383,a1577,b1394,Angry Birds 2,Casual,Rovio Entertainment Ltd.,4.5,Angry Birds Space,Arcade,Rovio Entertainment Ltd,3.9908,0
1143,9557,9557,a309,b1032,Bubble Witch 3 Saga,Puzzle,King,4.7,Bubble Witch Saga,Arcade,King,4.0284,0
2643,25168,25168,a2741,b2041,Scatter Slots: Free Fun Casino,Casino,Murka Ltd.,4.6,Quick Hit Slots Free Casino Slot Machines Games,Appchi Media Ltd,Appchi Media Ltd,3.49254,0
172,2818,2818,a2741,b254,Scatter Slots: Free Fun Casino,Casino,Murka Ltd.,4.6,Roulette Royale - FREE Casino ( Mywavia Studios ),Casino,Mywavia Studios Pvt. Ltd.,4.45454,0
1876,16637,16637,a3688,b1589,Xtreme Racing 2 - Speed Car RC,Racing,Genera Games,4.2,3D Emergency Parking Simulator Game - Real Police Fire-Truck Ambulance Car Driving School Test Park Sim Racing Games,Play With Games Ltd,Play With Games Ltd,3.69369,0
2654,25451,25451,a922,b2051,My Little Pony Celebration,Simulation,Hasbro Inc.,4.2,My Little Pony Friendship Celebration Cutie Mark Magic,Family,"Hasbro, Inc.",3.97403,0
814,8371,8371,a482,b758,Fishing for kids and babies,Educational,Babies and Kids Educational Games,3.9,My Dolphin Show: Pet animal game for girls &amp; kids,Family,SPIL GAMES,4.55556,0
3477,35394,35394,a2646,b2751,Slots Free - Big Win Casino\u2122,Casino,FiveStar Games - Slots and Casino,4.3,Big Win Football 2016,Simulation,Hothead Games Inc.,4.22483,0
2266,19345,19345,a1018,b1800,Angry Birds Star Wars,Arcade,Rovio Entertainment Ltd.,4.3,Angry Birds Go!,Arcade,Rovio Entertainment Ltd,3.55211,0
948,8886,8886,a3565,b874,The LEGO \u00ae Movie Video Game,Adventure,Warner Bros. International Enterprises,4.1,LEGO Star Wars: The Complete Saga,Adventure,Warner Bros.,4.13089,0
16,39,39,a1309,b14,Real Boxing,Sports,Vivid Games S.A.,4.2,Real Boxing,Action,Vivid Games S.A.,4.42387,1
2026,18014,18014,a420,b1659,3D Monster Truck Parking Game,Racing,Play With Games,3.9,Ferry Port Car Parking Simulator - Real Monster Bus Driving Test Truck Racing Run Race Games,Play With Games Ltd,Play With Games Ltd,4.45293,0
2020,17980,17980,a1933,b1657,Real Muscle Car,Racing,Pudlus Games,4,Gas Station Car Parking Simulator a Real Road Racing Park Game,Racing,Play With Games Ltd,4.1645,0
3587,36045,36045,a1566,b2856,OMG: TD!,Action,Yodo1 Games,4,OMG: TD!,Games,Yodo1 Games,4.36313,1
367,5061,5061,a2506,b426,Princess memory game for kids,Board,Owlet games for kids,3.8,Solitaire 2.0 -Play the Classic Card Game for Free,Games,Parconia Games,4.35526,0
1406,12158,12158,a1129,b1226,Kids doodle games for toddlers,Educational,Bimi Boo Kids - Games for boys and girls LLC,4.2,3D Fun Racing Semi-Truck Driving Simulator Game By Top Awesome Trucker Race-Car Games For Teen-s Kid-s &amp; Boy-s For Free,Racing,uTappz Mobile Development LLC,4.26238,0
4080,42280,42280,a833,b3476,FINAL FANTASY DIMENSIONS,Role Playing,"SQUARE ENIX Co.,Ltd.",4.3,MOBIUS FINAL FANTASY,Role Playing,SQUARE ENIX INC,4.05556,0
4167,43072,43072,a2332,b3568,Covet Fashion - Dress Up Game,Casual,Crowdstar Inc,4.1,Top Stylist - the fashion game,Role Playing,Crowdstar Inc,3.21458,0
2992,30407,30407,a2971,b2269,My Town : Beauty Spa Saloon,Educational,My Town Games Ltd,4.3,My New Baby Story - Makeup Spa &amp; Dressup Kids Game,Family,Kids Games Studios LLC,2.4,0
3144,32833,32833,a1328,b2435,Jurassic Park\u2122 Builder,Simulation,Ludia Inc.,4.2,Jurassic Park Builder,Entertainment,Ludia,4.34181,0
3851,38413,38413,a1120,b3168,Savanna - Coloring Games Kids,Educational,MagisterApp - Educational Games for kids,3.9,Preschool &amp; Kindergarten learning kids games free,Educational Books,"Kids Academy Co apps: Preschool &amp; Kindergarten Learning Kids Games, Educational Books, Free Songs",4.66667,0
1848,16452,16452,a1722,b1574,Flow Free: Bridges,Puzzle,Big Duck Games LLC,4.3,Flow Free,Entertainment,Big Duck Games LLC,4.58768,0
3469,35385,35385,a2038,b2747,Flight Pilot Simulator 3D Free,Simulation,Fun Games For Free,4.6,3D Police Drag Racing Driving Simulator Game: Race The Real Turbo Chase,Games,Mountain Wizard Games,4.3091,0
4293,43984,43984,a1018,b3689,Angry Birds Star Wars,Arcade,Rovio Entertainment Ltd.,4.3,Angry Birds Epic RPG,Adventure,Rovio Entertainment Ltd,4.69513,0
3474,35391,35391,a1469,b2751,BIG WIN Basketball,Sports,Hothead Games,4.1,Big Win Football 2016,Simulation,Hothead Games Inc.,4.22483,0
1935,17067,17067,a1549,b1609,Bike Race 3D - Moto Racing,Racing,MTS Free Games,3.9,3D Sports Cars Parking Simulator Racing Game ~ Real Driving Test Run Park Sim Games,Play With Games Ltd,Play With Games Ltd,4.03095,0
3323,34258,34258,a516,b2643,My Talking Tom,Casual,Outfit7,4.5,My Talking Tom,Entertainment,Outfit7 Limited,4.26376,1
1624,15466,15466,a1499,b1418,Pictoword: Word Guessing Games,Word,Kooapps LLC,4.7,Guess the movie (pop quiz trivia guessing Games)!,Trivia,Applewood Apps LLC,4.69227,0
3619,36181,36181,a2199,b2918,Kitchen Scramble: Cooking Game,Simulation,Rockyou Inc.,3.9,Bakery Blitz: Cooking Game,Strategy,"RockYou, Inc.",3.51087,0
542,6724,6724,a2741,b544,Scatter Slots: Free Fun Casino,Casino,Murka Ltd.,4.6,Caesars Slots Free Slot Machine Games,Playtika LTD,Playtika LTD,4.64308,0
2851,28238,28238,a2933,b2150,Kids Shopping Games,Educational,Hippo Kids Games,4.2,Breakfast Food Maker Kids Games (Girls &amp; Boys),Games,Free Addicting Games,3.67105,0
2725,26010,26010,a3621,b2063,Birthday party: Games for kids,Educational,Preschool & Kindergarten Learning Kids Games,4,Dino Puzzle: Kids Dinosaurs Puzzles Learning Games,Tiltan Games (2013) LTD,Tiltan Games (2013) LTD,4.46154,0
2454,22355,22355,a1549,b1906,Bike Race 3D - Moto Racing,Racing,MTS Free Games,3.9,`Stickman Police Car Crime Chase Race: The Doodle Chase Racing Free by Top Crazy Games,Top Crazy Games LLC,Top Crazy Games LLC,3.4,0
1459,13105,13105,a1520,b1265,Guess The Movie \u00ae - Full,Trivia,June Software Inc,4.5,Guess the Sneakers - Kicks Quiz for Sneakerheads,Inc.,"Tapgang Apps and Games, Inc.",3,0
1668,15701,15701,a2497,b1458,NCIS: Hidden Crimes,Adventure,Ubisoft Entertainment,4.5,CSI: Hidden Crimes,Puzzle,Ubisoft,4.10447,0
1903,16846,16846,a406,b1596,Reversi Free - King of Games,Casual,Cross Field Inc.,4.3,Motorcycle Games - motocross bike games for free,Entertainment,Falcon Mobile Inc.,10149 Ratings,0
552,6753,6753,a2716,b545,Slots Lucky Wolf Casino Slots,Casino,Rocket Speed - Casino Slots Games,4.4,Slots - Huuuge Casino: Free Slot Machines,Entertainment,Huuuge Games Sp. z o.o.,3.82759,0
362,5009,5009,a2796,b422,Checkers Free,Board,Optime Software,4,Checkers Free,Entertainment,Optime Software LLC,3.89353,1
549,6748,6748,a2684,b545,Casino Slots,Casino,Mouse Games,4,Slots - Huuuge Casino: Free Slot Machines,Entertainment,Huuuge Games Sp. z o.o.,3.82759,0
3556,35898,35898,a2355,b2808,Hoppy Frog,Casual,Turbo Chilli,4.2,Hoppy Frog,Family,Turbo Chilli Pty Ltd,4.59256,1
81,656,656,a588,b62,Hearts Card Game FREE,Card,Breakout Games,4.3,Hearts DeLuxe Free. Play the Classic card Game now,Games,Zithromia Games,4.53623,0
2836,27813,27813,a3655,b2117,Girls Hair Salon,Educational,Pazu Games,3.8,"Girls Hair Salon - Hair Style &amp; Makeover Games for Kids, by Pazu",Family,Pazu Games Ltd,4.05495,0
1730,16016,16016,a1682,b1526,Angry Birds,Arcade,Rovio Entertainment Ltd.,4.4,Angry Birds POP! - Bubble Shooter,Puzzle,Rovio Entertainment Ltd,4.32645,0
4177,43126,43126,a2306,b3583,Best Dress Up and Makeup Games,Casual,Best Girls Dress Up Makeup and Nail Manicure Games,3.8,"Make Up Me - Girls Makeup, Dressup and Makeover Games",Libii Girls Game,Libii Girls Game,4.38351,0
3512,35545,35545,a1250,b2765,TAP SPORTS BASEBALL,Sports,Glu,3.9,Tap Sports Baseball,Sports,Glu Games Inc,4.34544,1
355,4983,4983,a2741,b415,Scatter Slots: Free Fun Casino,Casino,Murka Ltd.,4.6,Slots 777 Casino Las Vegas-Style Slot Machines,Entertainment,Appchi Media Ltd,3.41667,0
2083,18456,18456,a413,b1687,RC Truck Racing Simulator 3D,Racing,i6 Games,3.7,Police Car Parking Simulator Game - Real Life Emergency Driving Test Sim Racing Games,Play With Games Ltd,Play With Games Ltd,4.23776,0
2449,22322,22322,a2241,b1906,Pako - Car Chase Simulator,Racing,Tree Men Games,4.4,`Stickman Police Car Crime Chase Race: The Doodle Chase Racing Free by Top Crazy Games,Top Crazy Games LLC,Top Crazy Games LLC,3.4,0
3049,31279,31279,a3584,b2316,Shapes Match for Kids,Educational,Eggroll Games,5,My Dolphin Show: Pet animal game for girls &amp; kids,Family,SPIL GAMES,4.55556,0
2690,25867,25867,a2933,b2061,Kids Shopping Games,Educational,Hippo Kids Games,4.2,Kindergarten Math Games For Kids (singapore) free,Educational Books,"Kids Academy Co apps: Preschool &amp; Kindergarten Learning Kids Games, Educational Books, Free Songs",4.54545,0
3015,30679,30679,a1129,b2285,Kids doodle games for toddlers,Educational,Bimi Boo Kids - Games for boys and girls LLC,4.2,"Makeup Girls - Wedding Dress Up &amp; Make Up Games for girls, by Pazu",Educational,Pazu Games Ltd,4.02412,0
554,6757,6757,a2735,b545,Casino Games - Cleopatra Slots,Casino,Free Slots & Casino games by Huuuge,4.5,Slots - Huuuge Casino: Free Slot Machines,Entertainment,Huuuge Games Sp. z o.o.,3.82759,0
693,7685,7685,a588,b639,Hearts Card Game FREE,Card,Breakout Games,4.3,Mouse Maze Free - Top Brain Puzzle Game,Games,Top Free Games,4.06959,0
3388,34947,34947,a1359,b2698,Boom Boom Football,Sports,Hothead Games,4,Boom Boom Football,Sports,Hothead Games Inc.,4.11111,1
4017,41704,41704,a24,b3416,Word Wall - Association Game,Word,MochiBits,4,Word to Word - A fun and addictive word association brain game,Word,"MochiBits, LLC",4.62631,0
649,7565,7565,a250,b615,LINE: Disney Tsum Tsum,Puzzle,LINE Corporation,4.2,LINE: Disney Tsum Tsum,Action,LINE Corporation,3.5625,1
3687,36674,36674,a2640,b2997,Empires and Allies,Strategy,Zynga,4.3,Empires &amp; Allies,Action,Zynga Inc.,22493 Ratings,0
3769,37041,37041,a1835,b3057,Witch Puzzle - Match 3 Game,Puzzle,Upbeat Games: Cool Fun and Addicting Games to Play,4.4,Gummy Drop! Free Match 3 Puzzle Game,Inc,"Big Fish Games, Inc",4.5732,0
420,5448,5448,a2651,b454,Governor of Poker 3 HOLDEM,Card,Youda Games Holding B.V.,4.5,Poker Party - Texas Holdem Game,Games,Crave Games,1110 Ratings,0
2641,25125,25125,a2645,b2040,Slots - Pharaoh's Fire,Casino,Cervo Media,4.4,Slots Pharaoh's Fire - The best free slots!,Entertainment,CERVO MEDIA GMBH,4.62962,0
3499,35462,35462,a2033,b2752,Flight Simulator: Fly Plane 3D,Simulation,i6 Games,3.9,3D Plane Flying Parking Simulator Game - Real Airplane Driving Test Run Sim Racing Games,Hybrid Touch Games Limited,Hybrid Touch Games Limited,3.81887,0
3913,39747,39747,a1806,b3236,Brain Age Test Free,Puzzle,Best Free Addictive Games Brain Game Factory,4.2,Word Crush - Word Search Brain Training Free Games,Mediaflex Games,Mediaflex Games,4.09293,0
1229,9874,9874,a1932,b1066,Traffic Racer,Racing,Soner Kara,4.4,Traffic Racer,Arcade,Soner Kara,4.26722,1
1089,9448,9448,a1706,b991,Shooting Simulator 3D,Simulation,VAPP - Games and Simulators,4,Flight Pilot Simulator 3D: Flying Game For Free,Simulation,Fun Games For Free,4.5734,0
2780,27137,27137,a1135,b2102,Dino Puzzle Games for Kids,Puzzle,Tiltan Games,4,Triplet Baby Doctor Salon Spa Kids Games Free,Games,Free Addicting Games,3.61176,0
2754,26519,26519,a1114,b2086,Peekaboo Kids - Free Kids Game,Education,Tappy Happy kids apps & games for kids,3.8,Zoo Sounds Free - A Fun Animal Sound Game for Kids,Education,Tantrum Apps,3.51724,0
2746,26272,26272,a1116,b2077,Elmo Calls by Sesame Street,Educational,Sesame Workshop,3.9,Elmo Calls,Educational,Sesame Street,none,0
3316,34242,34242,a1267,b2637,Tiny Tower,Simulation,NimbleBit LLC,4.5,Tiny Tower - Free City Building,Entertainment,NimbleBit LLC,4.6763,0
3476,35393,35393,a1361,b2751,Big Win Football 2016,Sports,Hothead Games,4,Big Win Football 2016,Simulation,Hothead Games Inc.,4.22483,1
