,Unnamed: 0,_id,ltable_ID,rtable_ID,ltable_name,ltable_category,ltable_developer,ltable_rating,rtable_name,rtable_category,rtable_developer,rtable_rating,label
1612,15434,15434,a18,b1409,Word Streak-Words With Friends,Word,Zynga,4.5,Word Streak With Friends - FREE,Entertainment,Zynga Inc.,4.03571,0
2242,19287,19287,a354,b1793,Extreme Rally SUV Simulator 3D,Racing,AxesInMotion Racing,3.8,Extreme Car Driving Simulator Free,Simulation,AxesInMotion S.L.,4.36311,0
187,2857,2857,a2742,b256,Big Fish Casino\u2122 \u2013 Free Slots,Casino,Big Fish Games,4.3,Slots Games - Free Casino Slot Machines,Casino,Huuuge Games Sp. z o.o.,2.875,0
3940,40369,40369,a2306,b3278,Best Dress Up and Makeup Games,Casual,Best Girls Dress Up Makeup and Nail Manicure Games,3.8,Close Up Christmas Quiz - Free Xmas Trivia Games,Mediaflex Games,Mediaflex Games,4.21311,0
251,3799,3799,a2809,b315,777 Slots Casino,Casino,Scientific Games Interactive (IL),4.4,FaFaFa - Real Casino Slots,Card,"International Games System Co., Ltd.",4.5302,0
357,4995,4995,a2764,b417,Fairway Solitaire Blast,Card,Big Fish Games,4.6,Fairway Solitaire,Inc,"Big Fish Games, Inc",4.7271,0
278,4345,4345,a1633,b367,Ski Safari: Adventure Time,Arcade,Cartoon Network,4.5,Card Wars Kingdom - Adventure Time,Action,Cartoon Network,4.27273,0
1717,15985,15985,a1764,b1520,Cut the Rope: Time Travel,Puzzle,ZeptoLab,4.5,Cut the Rope: Experiments Free,Action,ZeptoLab UK Limited,4.19998,0
1463,13137,13137,a588,b1270,Hearts Card Game FREE,Card,Breakout Games,4.3,Free Stickly Jump Game,LLC,"Best Free and Fun Games, LLC",3.98675,0
1923,16979,16979,a3637,b1601,Fast Car Parking,Simulation,Defne Games,4.2,Super Sports Car Parking Simulator - Real Driving Test Sim Racing Games,Play With Games Ltd,Play With Games Ltd,4.43713,0
610,7382,7382,a2735,b586,Casino Games - Cleopatra Slots,Casino,Free Slots & Casino games by Huuuge,4.5,Big Fish Casino Free Vegas Slots &amp; Tournaments,Inc,"Big Fish Games, Inc",4.53421,0
3429,35183,35183,a1361,b2727,Big Win Football 2016,Sports,Hothead Games,4,Football Heroes PRO 2016,Games,Run Games,3.95541,0
1374,11254,11254,a2773,b1188,All-in-One Solitaire FREE,Card,Pozirk Games Inc.,4,Free Solitaire Games,Best Free and Fun Games,"Best Free and Fun Games, LLC",3.73913,0
328,4749,4749,a2664,b400,Vegas Jackpot Slots Casino,Casino,Rocket Speed - Casino Slots Games,4.6,Jackpot City Slots Free Casino Slot Tournaments,Inc,"Big Fish Games, Inc",4.57735,0
781,8147,8147,a3786,b712,Lost Dots - Best Brain Games,Puzzle,Webelinx Games,4,"Go Go Goat! Free Game - by Best, Cool &amp; Fun Games",Best Free Games - Top Apps,Best Free Games - Top Apps,4.5,0
4149,42808,42808,a1731,b3553,Angry Birds Star Wars HD,Arcade,Rovio Entertainment Ltd.,4.2,Angry Birds Fight! RPG Puzzle,Action,Rovio Entertainment Ltd,4.46575,0
1962,17249,17249,a420,b1620,3D Monster Truck Parking Game,Racing,Play With Games,3.9,"Crash Drive 2: The multiplayer stunt game, with monster trucks &amp; classic muscle cars",Racing,SPIL GAMES,4.42723,0
2211,19175,19175,a1305,b1773,Drive Ahead! Sports,Sports,Dodreams Ltd.,4.3,Drive Ahead!,Racing,Dodreams Fairytale Company Oy,16988 Ratings,0
2355,20321,20321,a2506,b1832,Princess memory game for kids,Board,Owlet games for kids,3.8,Bliss Lite - The Game for Lovers,Dice,Games for Loving,117 Ratings,0
2781,27147,27147,a3591,b2102,Coloring games for kids animal,Casual,2bros - games for kids,4.3,Triplet Baby Doctor Salon Spa Kids Games Free,Games,Free Addicting Games,3.61176,0
3399,35018,35018,a1433,b2706,Bouncy Basketball,Sports,Dreamon Studios,4.3,Real Bouncy Basketball,Sports,Dreamon Studios AB,3.96458,0
784,8158,8158,a2624,b712,Ninja Kid Run Free - Fun Games,Action,Fun Games For Free,4.1,"Go Go Goat! Free Game - by Best, Cool &amp; Fun Games",Best Free Games - Top Apps,Best Free Games - Top Apps,4.5,0
2749,26383,26383,a1114,b2081,Peekaboo Kids - Free Kids Game,Education,Tappy Happy kids apps & games for kids,3.8,Farm Sounds Free - Fun Barn Animal Noises for your Kids,Educational,Tantrum Apps,3.25628,0
3373,34791,34791,a3688,b2682,Xtreme Racing 2 - Speed Car RC,Racing,Genera Games,4.2,Quarry Driver Parking Game - Real Mining Monster Truck Car Driving Test Park Sim Racing Games,Play With Games Ltd,Play With Games Ltd,4.30739,0
522,6594,6594,a2745,b534,GSN Casino: Free Slot Machines,Casino,"GSN Games, Inc.",4.3,Xtreme Slots - FREE Las Vegas Casino Slot Machines,Card,"Meme, Inc",4.22581,0
3055,31322,31322,a2275,b2321,Animal Jam - Play Wild!,Casual,WildWorks,4.6,Animal Jam - Play Wild!,Social Networking,"Wildworks, Inc.",4.58333,1
1210,9847,9847,a2568,b1060,Stupid Zombies 2,Casual,GameResort,4.1,Stupid Zombies Free: Gun Shooting Fun,Entertainment,GameResort LLC,4.82099,0
1083,9419,9419,a413,b991,RC Truck Racing Simulator 3D,Racing,i6 Games,3.7,Flight Pilot Simulator 3D: Flying Game For Free,Simulation,Fun Games For Free,4.5734,0
1017,9256,9256,a2566,b928,Stupid Zombies 3,Casual,GameResort,4.6,Stupid Zombies 2 Free,Action,GameResort LLC,4.21812,0
1403,12040,12040,a1537,b1225,Guess The Song - Music Quiz,Trivia,S Quiz It!,4.2,Icon Song Pop Quiz: a 4 pic word game to guess what's that 1 music!,Games,Fancy Quiz Games,3.87,0
1723,15999,15999,a363,b1525,Bubble Witch 2 Saga,Casual,King,4.3,Bubble Witch Saga,Arcade,King,4.0284,0
3245,33791,33791,a1973,b2552,Bakery Blitz: Cooking Game,Simulation,Rockyou Inc.,4.1,Kitchen Scramble: Cooking Game,Arcade,"RockYou, Inc.",3.28571,0
2796,27409,27409,a1098,b2110,Train Games for Kids: Puzzles,Education,Scott Adelman Apps Inc,3.8,Preschool &amp; Kindergarten learning kids games free,Educational Books,"Kids Academy Co apps: Preschool &amp; Kindergarten Learning Kids Games, Educational Books, Free Songs",4.66667,0
1244,9995,9995,a273,b1088,Hill Climb Racing 2,Racing,Fingersoft,4.6,Hill Climb Racing 2,Entertainment,Fingersoft,4.68943,1
4136,42763,42763,a175,b3545,FINAL FANTASY BRAVE EXVIUS,Role Playing,"SQUARE ENIX Co.,Ltd.",4.6,FINAL FANTASY BRAVE EXVIUS,Role Playing,SQUARE ENIX INC,4.61956,1
3789,37127,37127,a853,b3069,Clash of Lords 2: New Age,Strategy,IGG.COM,4.5,Castle Clash: Rise of Beasts,Action,IGG.COM,3.69272,0
145,2308,2308,a993,b201,Build and Play 3D - The Sequel,Casual,Croco Studio Games,4.5,Spades Free! Play the Classic Card Game for Free,Games,Shozila Games,4.21052,0
8,18,18,a1662,b6,Temple Run,Arcade,Imangi Studios,4.3,Temple Run,Arcade,"Imangi Studios, LLC",4.04039,1
3111,32104,32104,a2270,b2374,Where's My Mickey? Free,Puzzle,Disney,4,Where's My Mickey? Free,Puzzle,Disney,3.79347,1
3130,32646,32646,a519,b2408,Nyan Cat: The Space Journey,Adventure,isTom Games,4.3,Nyan Cat: Lost In Space,Puzzle,Istom Games Kft.,4.66667,0
80,652,652,a498,b62,Zsirozas - Fat card game,Card,Saj\u00f3 Games,4.2,Hearts DeLuxe Free. Play the Classic card Game now,Games,Zithromia Games,4.53623,0
1978,17543,17543,a420,b1627,3D Monster Truck Parking Game,Racing,Play With Games,3.9,Navy Boat Parking Simulator Game - Real Army Sailing Driving Test Run Park Sim Games,Play With Games Ltd,Play With Games Ltd,4.18621,0
1106,9478,9478,a1577,b994,Angry Birds 2,Casual,Rovio Entertainment Ltd.,4.5,Angry Birds Blast,Puzzle,Rovio Entertainment Ltd,4.62446,0
1444,13013,13013,a1126,b1260,Pooza - FREE Puzzles for Kids,Education,ImagiRation LLC,4.5,A Cool Adventure Hunter The Duck Shoot-ing Game by Animal-s Hunt-ing &amp; Fish-ing Games For Adult-s Teen-s &amp; Boy-s Free,Music,uTappz Mobile Development LLC,4.22511,0
1846,16449,16449,a1904,b1572,Candy Crush Jelly Saga,Puzzle,King,4.3,Candy Crush Soda Saga,Arcade,King,4.35701,0
3082,31773,31773,a3655,b2337,Girls Hair Salon,Educational,Pazu Games,3.8,"Makeup Girls - Make Up &amp; Beauty Salon games for girls, by Pazu",Educational,Pazu Games Ltd,4.03071,0
3519,35784,35784,a1447,b2781,Top Eleven Be a Soccer Manager,Sports,Nordeus,4.4,Top Eleven 2017 - Be a Soccer Manager,Sports,Nordeus,4.19998,0
359,4998,4998,a2814,b419,Chess Free,Board,Optime Software,4,Chess Free,Strategy,Optime Software LLC,3.97327,1
4083,42284,42284,a785,b3476,FINAL FANTASY V,Role Playing,"SQUARE ENIX Co.,Ltd.",4.5,MOBIUS FINAL FANTASY,Role Playing,SQUARE ENIX INC,4.05556,0
486,6144,6144,a2735,b508,Casino Games - Cleopatra Slots,Casino,Free Slots & Casino games by Huuuge,4.5,Old Vegas Slots: Free Classic Casino Slot Machines,LLC,"DGN Games, LLC",3.28571,0
1187,9679,9679,a2449,b1045,PAC-MAN 256 - Endless Maze,Arcade,BANDAI NAMCO Entertainment Europe,4.4,PAC-MAN 256 - Endless Arcade Maze,Action,BANDAI NAMCO Entertainment Europe,4.57555,0
13,35,35,a1243,b12,Super Stickman Golf 2,Sports,Noodlecake Studios Inc,4.2,Super Stickman Golf 2,Arcade,Noodlecake Studios Inc,4.6353,1
2390,21029,21029,a1129,b1853,Kids doodle games for toddlers,Educational,Bimi Boo Kids - Games for boys and girls LLC,4.2,Dentist Games of Ninja - Fun Kids Games for Boys &amp; Girls,Entertainment,"Mega Rock, LLC",2.5,0
3380,34816,34816,a1391,b2686,Stickman Soccer,Sports,Djinnworks GmbH,4.1,Stickman Soccer 2014,Action,Djinnworks GmbH,4.30346,0
1610,15425,15425,a1504,b1407,Guess The Emoji,Word,"Random Logic Games, LLC",4.4,Guess the Color - ColorMania,Trivia,Potato Powered Games Ltd,4.32777,0
757,8000,8000,a2826,b683,Shelter: A Survival Card Game,Board,Survivalist Games,4.2,Midnight Castle A Hidden Object Mystery Game,Inc,"Big Fish Games, Inc",4.22642,0
1063,9375,9375,a1577,b969,Angry Birds 2,Casual,Rovio Entertainment Ltd.,4.5,Angry Birds,Arcade,Rovio Entertainment Ltd,3.67521,0
3994,41472,41472,a1559,b3391,Chess With Friends Free,Board,Zynga,4.3,Word Streak With Friends - PAID,Word,Zynga Inc.,4.30189,0
84,672,672,a993,b62,Build and Play 3D - The Sequel,Casual,Croco Studio Games,4.5,Hearts DeLuxe Free. Play the Classic card Game now,Games,Zithromia Games,4.53623,0
3707,36752,36752,a3211,b3009,Color Block Puzzle Brick Game,Casual,Baca Baca Games,null,Cascade: Free Spin and Match Puzzle Game!,Inc,"Big Fish Games, Inc",4.80089,0
3072,31740,31740,a3029,b2335,Where's My Mickey?,Puzzle,Disney,4.1,Where's My Perry?,Entertainment,Disney,3.46729,0
966,8943,8943,a1662,b892,Temple Run,Arcade,Imangi Studios,4.3,Temple Run 2,Adventure,"Imangi Studios, LLC",4.04082,0
4142,42771,42771,a1026,b3548,Galaxy Legend,Role Playing,"Tap4fun Corp., Ltd.",4.2,Galaxy Legend,Strategy,Tap4Fun Game Ltd,4218 Ratings,1
3065,31722,31722,a2301,b2333,Dress Up - Doll Salon,Casual,Libii,4,Dress Up - Wedding,Entertainment,Libii Tech Limited,3.81595,0
3124,32521,32521,a382,b2393,Baby Care Babysitter & Daycare,Educational,BATOKI - Best Apps for Toddlers and Kids,3.9,Baby Care &amp; Dress Up - Love &amp; Have Fun with Babies,Education,Kids Fun Club by TabTale,3.8,0
59,454,454,a684,b45,Cars & Trucks Puzzle for Kids,Puzzle,Pixel Envision Ltd.,3.7,Christmas Games - Santa Claus Toy Party for kids,Education,Tiltan Games (2013) LTD,139 Ratings,0
3259,33881,33881,a1980,b2587,Disney Magic Kingdoms,Simulation,Gameloft,4.2,Disney Magic Kingdoms,Entertainment,Gameloft,4.2085,1
1918,16948,16948,a1933,b1600,Real Muscle Car,Racing,Pudlus Games,4,Car Parking Driving Simulator Game - Real Monster Truck Test Drive Park Sim Racing Games,Play With Games Ltd,Play With Games Ltd,4.37015,0
1976,17455,17455,a3329,b1625,Fun School Race Games for Kids,Educational,Tiny Lab Productions,4.3,Super Bird Adventure: Run and Jump Flappy Free Games for Kids by Top Fun 2,Action,FREE RACE MULTIPLAYER WORLD TINY LEPS HERO ROBIN WINGS,4.3512,0
2873,28492,28492,a3591,b2160,Coloring games for kids animal,Casual,2bros - games for kids,4.3,PBS KIDS Games,PBS KIDS,PBS KIDS,3.83333,0
3467,35383,35383,a2022,b2747,Sea Plane: Flight Simulator 3D,Simulation,i6 Games,3.8,3D Police Drag Racing Driving Simulator Game: Race The Real Turbo Chase,Games,Mountain Wizard Games,4.3091,0
1673,15769,15769,a1559,b1473,Chess With Friends Free,Board,Zynga,4.3,Matching With Friends Free,Puzzle,Zynga Inc.,4.12,0
4276,43967,43967,a2646,b3684,Slots Free - Big Win Casino\u2122,Casino,FiveStar Games - Slots and Casino,4.3,BIG WIN Basketball,Sports,Hothead Games Inc.,4.09202,0
4067,42222,42222,a1559,b3467,Chess With Friends Free,Board,Zynga,4.3,Words With Friends: Free Word Game - Fun for All,Word,Zynga Inc.,4.28902,0
3210,33557,33557,a1910,b2510,MAYDAY! Emergency Landing,Simulation,Reludo srl,4,MAYDAY! Emergency Landing,Simulation,Reludo,4.07462,1
477,6130,6130,a2646,b508,Slots Free - Big Win Casino\u2122,Casino,FiveStar Games - Slots and Casino,4.3,Old Vegas Slots: Free Classic Casino Slot Machines,LLC,"DGN Games, LLC",3.28571,0
4104,42368,42368,a3033,b3488,My Town : Dance School,Educational,My Town Games Ltd,4.7,My First Crush - High School Love,Entertainment,TabTale LTD,4.30471,0
1117,9493,9493,a432,b999,LEGO\u00ae Juniors Create & Cruise,Educational,LEGO System A/S,4,LEGO Juniors Create &amp; Cruise,Educational,"LEGO Systems, Inc",3.80247,0
715,7754,7754,a1618,b651,Angry Birds Epic RPG,Role Playing,Rovio Entertainment Ltd.,4.5,Angry Birds 2,Puzzle,Rovio Entertainment Ltd,4.6052,0
2074,18281,18281,a3591,b1680,Coloring games for kids animal,Casual,2bros - games for kids,4.3,Ninja Revinja Free - Real Uber Racing Run for Kids,Games,Sizzle Entertainment: The Best Fun Free Cool Apps and Top Addicting Games,4.32258,0
3650,36469,36469,a2015,b2939,World of Dragons: Simulator,Simulation,Gluten Free Games,4.1,Lux Touch - risk of world war game,Games,Sillysoft Games,4.17722,0
3990,41460,41460,a1849,b3388,Imago - Puzzle Game,Puzzle,Arkadium Games,4.4,Letris 4: Best word puzzle game,Games,Ivanovich Games,4.24127,0
2054,18166,18166,a420,b1678,3D Monster Truck Parking Game,Racing,Play With Games,3.9,Truck Parking Simulator - Ice Road Truckers Edition,Family,Play With Games Ltd,4.37478,0
1372,11173,11173,a1489,b1185,Hi Guess the Basketball Star,Trivia,HI STUDIO LIMITED,4.2,Guess The Music Artist - Free Quiz Game About Singers And Bands,Music,Wubu Apps Limited,4.44554,0
2857,28334,28334,a1129,b2154,Kids doodle games for toddlers,Educational,Bimi Boo Kids - Games for boys and girls LLC,4.2,Christmas Food Fever Cooking Maker Kids Games,Fancy Quiz Games,Fancy Quiz Games,3.82545,0
391,5281,5281,a30,b443,Words With Friends \u2013 Play Free,Word,Zynga,4.3,Words With Friends: Free Word Game - Fun for All,Word,Zynga Inc.,4.29223,0
1238,9969,9969,a510,b1078,Candy Crush Saga,Casual,King,4.4,Candy Crush Jelly Saga,Puzzle,King,4.46666,0
58,448,448,a482,b45,Fishing for kids and babies,Educational,Babies and Kids Educational Games,3.9,Christmas Games - Santa Claus Toy Party for kids,Education,Tiltan Games (2013) LTD,139 Ratings,0
568,6976,6976,a2741,b559,Scatter Slots: Free Fun Casino,Casino,Murka Ltd.,4.6,Slots House of Fun - Free Casino Games,Pacific-Interactive ltd,Pacific-Interactive ltd,4.64727,0
3493,35452,35452,a1981,b2752,Block Craft 3D: Building Game,Simulation,Fun Games For Free,4.5,3D Plane Flying Parking Simulator Game - Real Airplane Driving Test Run Sim Racing Games,Hybrid Touch Games Limited,Hybrid Touch Games Limited,3.81887,0
2268,19348,19348,a1656,b1803,Fun Run 2 - Multiplayer Race,Arcade,Dirtybit,4.5,Fun Run - Multiplayer Race,Racing,dirtyBit,4.73072,0
2859,28357,28357,a2933,b2154,Kids Shopping Games,Educational,Hippo Kids Games,4.2,Christmas Food Fever Cooking Maker Kids Games,Fancy Quiz Games,Fancy Quiz Games,3.82545,0
3885,39393,39393,a1501,b3208,Guess the Word,Word,"Random Logic Games, LLC",4.2,Guess the Color - ColorMania,Trivia,Potato Powered Games Ltd,4.32785,0
1897,16720,16720,a1129,b1591,Kids doodle games for toddlers,Educational,Bimi Boo Kids - Games for boys and girls LLC,4.2,Monster Truck by Fun Games For Free,Arcade,Fun Games For Free,4.49278,0
2465,22439,22439,a1098,b1911,Train Games for Kids: Puzzles,Education,Scott Adelman Apps Inc,3.8,Kids Learning Puzzles: The Family Handyman - Tangram Building Blocks Make Your Brain Pop,Dice,Swipea Kids Apps,14 Ratings,0
1293,10198,10198,a1054,b1115,Kids Numbers and Math FREE,Educational,Intellijoy Educational Games for Kids,4.2,Racing Penguin Free - Top Flying and Diving Game,Games,Top Free Games,4.38982,0
3053,31294,31294,a1736,b2316,Box Island - Kids Coding Game!,Educational,Radiant Games,4.4,My Dolphin Show: Pet animal game for girls &amp; kids,Family,SPIL GAMES,4.55556,0
1173,9663,9663,a1576,b1042,Angry Birds Go!,Racing,Rovio Entertainment Ltd.,4.2,Angry Birds Star Wars Free,Arcade,Rovio Entertainment Ltd,3.9294,0
1136,9545,9545,a829,b1021,Spider-Man Unlimited,Action,Gameloft,4.2,Spider-Man Unlimited,Action,Gameloft,4.2458,1
1626,15475,15475,a218,b1420,Hidden Object Mystery Guardian,Adventure,Big Bear Entertainment,4,Hidden City: Mystery of Shadows,Adventure,G5 Entertainment,4.28238,0
717,7756,7756,a1679,b651,Angry Birds Rio,Arcade,Rovio Entertainment Ltd.,4.4,Angry Birds 2,Puzzle,Rovio Entertainment Ltd,4.6052,0
1748,16075,16075,a3171,b1528,Flower Smash Match 3,Casual,Match 3 Fun Games,4.5,Gummy Drop! Free Match 3 Puzzle Game,Inc,"Big Fish Games, Inc",4.57273,0
1025,9276,9276,a402,b942,Farm Heroes Saga,Casual,King,4.4,Farm Heroes Super Saga,Arcade,King,4.56379,0
588,7169,7169,a2624,b575,Ninja Kid Run Free - Fun Games,Action,Fun Games For Free,4.1,Zombie Tower Shooting Defense Free - by Top Free Games,Top Free Games,Top Free Games,4.69363,0
2252,19330,19330,a1656,b1797,Fun Run 2 - Multiplayer Race,Arcade,Dirtybit,4.5,Fun Run 2 - Multiplayer Race,Sports,dirtyBit,30579 Ratings,1
1854,16459,16459,a1956,b1576,4x4 Offroad Driving 3D,Simulation,i6 Games,3.7,4x4 Dirt Track Trials Forest Driving Parking Sim,Sports,Play With Games Ltd,4.69468,0
1477,13340,13340,a1962,b1276,Drag Racing 4x4,Racing,Creative Mobile,4.3,3D Action Motorcycle Nitro Drag Racing Game By Best Motor Cycle Racer Adventure Games For Boy-s Kid-s &amp; Teen-s Pro,Sports,uTappz Mobile Development LLC,4.35335,0
2950,29998,29998,a3336,b2245,Explorium: Space for Kids,Educational,Applied Systems Ltd.,4.4,"Chic Baby - Baby Care &amp; Dress Up Games for Kids, by Pazu",Family,Pazu Games Ltd,4.07619,0
4223,43494,43494,a1332,b3627,BIG WIN Racing,Sports,Hothead Games,3.9,Big Win Soccer,Sports,Hothead Games Inc.,4.28571,0
4115,42510,42510,a2597,b3503,Empire Z: Endless War,Strategy,Ember Entertainment,4.2,Empire Z: Endless War,Entertainment,Ember Entertainment,4.09999,1
2372,20592,20592,a1098,b1839,Train Games for Kids: Puzzles,Education,Scott Adelman Apps Inc,3.8,Kids Learning Puzzles: Dogs - My Math Educreations Brain Pop Building Blocks,Trivia,Swipea Kids Apps,31 Ratings,0
2945,29981,29981,a1133,b2245,Coloring book for kids,Educational,Bimi Boo Kids - Games for boys and girls LLC,4.2,"Chic Baby - Baby Care &amp; Dress Up Games for Kids, by Pazu",Family,Pazu Games Ltd,4.07619,0
855,8578,8578,a1202,b803,The Secret Society\u00ae,Adventure,G5 Entertainment,4.3,The Secret Society - Hidden Mystery,Adventure,G5 Entertainment,4.28137,0
3073,31741,31741,a2270,b2335,Where's My Mickey? Free,Puzzle,Disney,4,Where's My Perry?,Entertainment,Disney,3.46729,0
3215,33631,33631,a2202,b2523,Restaurant Story: Earth Day,Casual,Storm8 Studios,4.3,Restaurant Story 2,Family,Storm8 Studios,4.20132,0
1737,16042,16042,a2447,b1527,101-in-1 Games HD,Arcade,Nordcurrent,4.4,101-in-1 Games !,Entertainment,Nordcurrent,4.5128,0
774,8129,8129,a1299,b705,Jurassic World\u2122: The Game,Simulation,Ludia Inc.,4.1,Walking Dead: The Game - Season 2,Adventure,Telltale Inc,4.19998,0
4085,42286,42286,a825,b3476,FINAL FANTASY III,Role Playing,"SQUARE ENIX Co.,Ltd.",4.5,MOBIUS FINAL FANTASY,Role Playing,SQUARE ENIX INC,4.05556,0
1785,16269,16269,a403,b1544,Candy Crush Soda Saga,Casual,King,4.3,Candy Crush Jelly Saga,Puzzle,King,4.46666,0
3726,36870,36870,a216,b3025,Clash of the Damned,Role Playing,Creative Mobile Publishing,4.1,The Hobbit: Kingdoms of Middle-earth,Strategy,Gaea Mobile Ltd,2.44443,0
819,8407,8407,a1135,b758,Dino Puzzle Games for Kids,Puzzle,Tiltan Games,4,My Dolphin Show: Pet animal game for girls &amp; kids,Family,SPIL GAMES,4.55556,0
2628,25092,25092,a396,b2039,TUNING Racing 3D,Racing,Foose Games,3.8,Ninja Run Multiplayer 3D Racing: Free Racing Games,Sizzle Entertainment: The Best Fun Free Cool Apps and Top Addicting Games,Sizzle Entertainment: The Best Fun Free Cool Apps and Top Addicting Games,4.44761,0
4150,42809,42809,a1679,b3553,Angry Birds Rio,Arcade,Rovio Entertainment Ltd.,4.4,Angry Birds Fight! RPG Puzzle,Action,Rovio Entertainment Ltd,4.46575,0
3213,33578,33578,a2431,b2517,Disco Zoo,Casual,NimbleBit LLC,4.5,Disco Zoo,Simulation,NimbleBit LLC,4.62857,1
455,5765,5765,a2664,b487,Vegas Jackpot Slots Casino,Casino,Rocket Speed - Casino Slots Games,4.6,High 5 Casino - Free Real Vegas Slots!,Games,High 5 Games,4.09375,0
52,386,386,a3627,b41,Kids Learn Shapes FREE,Educational,Intellijoy Educational Games for Kids,3.8,Color Bubbles Pop Mania - Cute Fun Simple Silly Boys and Girls Game (Free HD Kids Games),Games,Top Action Games,4.23112,0
1806,16372,16372,a1849,b1551,Imago - Puzzle Game,Puzzle,Arkadium Games,4.4,Mouse Maze Free - Top Brain Puzzle Game,Games,Top Free Games,4.06959,0
2861,28365,28365,a1175,b2156,Thomas & Friends: Delivery,Casual,Budge Studios,4.1,Thomas &amp; Friends: Go Go Thomas! Speed Challenge,Racing,Budge Studios,4.02885,0
20,94,94,a1017,b22,STAR WARS\u2122: FORCE COLLECTION,Strategy,KONAMI,3.8,STAR WARS: FORCE COLLECTION,Entertainment,KONAMI,3.97727,0
194,2921,2921,a2690,b265,OMG! Fortune Free Slots Casino,Casino,LuckyFish Games \u2013 Free Slot Machines,4.3,OMG! Fortune Free Slots Play Vegas Casino Games!,Games,LuckyFish Games,786 Ratings,0
1213,9856,9856,a2348,b1061,Angry Birds Seasons,Arcade,Rovio Entertainment Ltd.,4.3,Angry Birds Star Wars II,Action,Rovio Entertainment Ltd,4.42187,0
2365,20484,20484,a3236,b1838,Snake Fun Game,Casual,Pixotri Technologies Pvt Ltd,4.1,Jewel Games Candy Christmas 2013 Edition - Fun Candies and Diamonds Swapping Game For Kids HD FREE,Puzzle,Evolax Ltd,3.70408,0
1086,9427,9427,a588,b991,Hearts Card Game FREE,Card,Breakout Games,4.3,Flight Pilot Simulator 3D: Flying Game For Free,Simulation,Fun Games For Free,4.5734,0
1346,10576,10576,a2712,b1160,Slots Lost Treasure Slot Games,Casino,Rocket Speed - Casino Slots Games,4.4,SLOTS: Jason Aldean FREE Slot Machines,Music,Ghost Town Slots LLC,4.75614,0
1217,9860,9860,a1577,b1061,Angry Birds 2,Casual,Rovio Entertainment Ltd.,4.5,Angry Birds Star Wars II,Action,Rovio Entertainment Ltd,4.42187,0
2704,25919,25919,a3392,b2061,Kids Dinosaur Games: Puzzles,Education,Scott Adelman Apps Inc,3.8,Kindergarten Math Games For Kids (singapore) free,Educational Books,"Kids Academy Co apps: Preschool &amp; Kindergarten Learning Kids Games, Educational Books, Free Songs",4.54545,0
2928,29769,29769,a1544,b2222,Lumosity - Brain Training,Education,"Lumos Labs, Inc.",4.2,Brain Wars: Competitive brain training game,Education,"Translimit, Inc.",4.62649,0
1454,13097,13097,a793,b1265,Battle for the Galaxy,Strategy,AMT Games,4.2,Guess the Sneakers - Kicks Quiz for Sneakerheads,Inc.,"Tapgang Apps and Games, Inc.",3,0
2840,27918,27918,a3552,b2132,Star Girl Salon,Educational,Libii,3.9,Pop Star Salon,Family,Libii Tech Limited,4.08828,0
2823,27765,27765,a1129,b2117,Kids doodle games for toddlers,Educational,Bimi Boo Kids - Games for boys and girls LLC,4.2,"Girls Hair Salon - Hair Style &amp; Makeover Games for Kids, by Pazu",Family,Pazu Games Ltd,4.05495,0
2096,18541,18541,a419,b1693,Monster Truck Racing 3D,Racing,i6 Games,3.7,3D Police Drag Racing Driving Simulator Game: Race The Real Turbo Chase,Games,Mountain Wizard Games,4.3091,0
1756,16095,16095,a1840,b1528,Bubble Hunt - puzzle game,Puzzle,Cross Field Inc.,3.8,Gummy Drop! Free Match 3 Puzzle Game,Inc,"Big Fish Games, Inc",4.57273,0
4000,41478,41478,a2306,b3392,Best Dress Up and Makeup Games,Casual,Best Girls Dress Up Makeup and Nail Manicure Games,3.8,Close Up Animal Quiz - Cat &amp; Dog Trivia Games Free,Games,Mediaflex Games,8604 Ratings,0
1735,16032,16032,a2412,b1526,Angry Birds Space,Arcade,Rovio Entertainment Ltd.,4.4,Angry Birds POP! - Bubble Shooter,Puzzle,Rovio Entertainment Ltd,4.32645,0
3074,31742,31742,a2496,b2336,MONOPOLY HERE & NOW,Board,Hasbro Inc.,3.9,MONOPOLY HERE &amp; NOW,Family,"Hasbro, Inc.",3.96078,0
4102,42354,42354,a3774,b3484,My Newborn Baby Care Madness,Casual,Baca Baca Games,3.7,New Baby Sister - Girls Newborn Salon Kids Games,Kids Games Studios LLC,Kids Games Studios LLC,2.59999,0
585,7131,7131,a406,b571,Reversi Free - King of Games,Casual,Cross Field Inc.,4.3,Bingo Bash: Wheel of Fortune Free Bingo + Slots,Entertainment,BitRhymes Inc.,4.55238,0
3410,35065,35065,a1549,b2707,Bike Race 3D - Moto Racing,Racing,MTS Free Games,3.9,Ferry Port Car Parking Simulator - Real Monster Bus Driving Test Truck Racing Run Race Games,Play With Games Ltd,Play With Games Ltd,4.45404,0
360,5001,5001,a1862,b420,Unblock Me FREE,Puzzle,"Kiragames Co., Ltd.",4.3,Unroll Me - unblock the slots,Board,Turbo Chilli Pty Ltd,4.29251,0
3916,39815,39815,a1482,b3238,Guess the GIF,Trivia,"Random Logic Games, LLC",4.3,"Guess The Brand Game - #1 Logotype pop quiz and trivia to test who knows what's that food, car or fashion company logo!",Word,Lucerotech LLC,4.67694,0
3223,33712,33712,a1260,b2546,Hollywood U: Rising Stars,Simulation,Pixelberry,4.2,Hollywood U: Rising Stars,Simulation,Pixelberry Studios,4.31496,1
2942,29972,29972,a1100,b2245,Funny Cars for Kids,Educational,Hogsmith Games,4.4,"Chic Baby - Baby Care &amp; Dress Up Games for Kids, by Pazu",Family,Pazu Games Ltd,4.07619,0
2478,22821,22821,a2716,b1931,Slots Lucky Wolf Casino Slots,Casino,Rocket Speed - Casino Slots Games,4.4,Slots Jackpot Inferno - Free Progressive Macau and Vegas Casino Games,Rocket Speed,"Rocket Speed, Inc.",4.78261,0
689,7673,7673,a646,b638,DEER HUNTER 2017,Action,Glu,4.3,Deer Hunter 2017,Sports,Glu Games Inc,3.94737,1
2849,28215,28215,a1135,b2150,Dino Puzzle Games for Kids,Puzzle,Tiltan Games,4,Breakfast Food Maker Kids Games (Girls &amp; Boys),Games,Free Addicting Games,3.67105,0
1599,15391,15391,a1018,b1394,Angry Birds Star Wars,Arcade,Rovio Entertainment Ltd.,4.3,Angry Birds Space,Arcade,Rovio Entertainment Ltd,3.9908,0
468,5800,5800,a1267,b489,Tiny Tower,Simulation,NimbleBit LLC,4.5,Tiny Tower Vegas,Casino,NimbleBit LLC,4.58289,0
